f667e680 1127762832 C Ii:1:001:1 0:2048 2 = 2000
f667e680 1127762858 S Ii:1:001:1 -115:2048 4 <
f6130e00 1127762880 S Ci:1:001:0 s a3 00 0000 0005 0004 4 <
f6130e00 1127762888 C Ci:1:001:0 0 4 = 01050100
f6130e00 1127762894 S Co:1:001:0 s 23 01 0010 0005 0000 0
f6130e00 1127762900 C Co:1:001:0 0 0
f6130e00 1127762905 S Ci:1:001:0 s a3 00 0000 0005 0004 4 <
f6130e00 1127762910 C Ci:1:001:0 0 4 = 01050000
f6130e00 1127793433 S Ci:1:001:0 s a3 00 0000 0005 0004 4 <
f6130e00 1127793448 C Ci:1:001:0 0 4 = 01050000
f6130e00 1127825450 S Ci:1:001:0 s a3 00 0000 0005 0004 4 <
f6130e00 1127825464 C Ci:1:001:0 0 4 = 01050000
f6130e00 1127857416 S Ci:1:001:0 s a3 00 0000 0005 0004 4 <
f6130e00 1127857430 C Ci:1:001:0 0 4 = 01050000
f6130e00 1127889414 S Ci:1:001:0 s a3 00 0000 0005 0004 4 <
f6130e00 1127889428 C Ci:1:001:0 0 4 = 01050000
f6130e00 1127889445 S Co:1:001:0 s 23 03 0004 0005 0000 0
f6130e00 1127889452 C Co:1:001:0 0 0
f6130e00 1127945435 S Ci:1:001:0 s a3 00 0000 0005 0004 4 <
f6130e00 1127945710 C Ci:1:001:0 0 4 = 03051000
f6130e00 1128001429 S Co:1:001:0 s 23 01 0014 0005 0000 0
f6130e00 1128001445 C Co:1:001:0 0 0
f6130e00 1128001471 S Ci:1:000:0 s 80 06 0100 0000 0040 64 <
f6130e00 1128001727 C Ci:1:000:0 0 18 = 12010002 00000040 b8228d60 01000302 0501
f6130e00 1128001788 S Co:1:001:0 s 23 03 0004 0005 0000 0
f6130e00 1128001822 C Co:1:001:0 0 0
f6130e00 1128057450 S Ci:1:001:0 s a3 00 0000 0005 0004 4 <
f6130e00 1128057708 C Ci:1:001:0 0 4 = 03051000
f6130e00 1128113424 S Co:1:001:0 s 23 01 0014 0005 0000 0
f6130e00 1128113513 C Co:1:001:0 0 0
f6130e00 1128113546 S Co:1:000:0 s 00 05 000c 0000 0000 0
f6130e00 1128113718 C Co:1:000:0 0 0
f6130e00 1128133418 S Ci:1:012:0 s 80 06 0100 0000 0012 18 <
f6130e00 1128133599 C Ci:1:012:0 0 18 = 12010002 00000040 b8228d60 01000302 0501
f6130e00 1128133651 S Ci:1:012:0 s 80 06 0200 0000 0009 9 <
f6130e00 1128133851 C Ci:1:012:0 0 9 = 09022000 01010680 fa
f6130e00 1128133892 S Ci:1:012:0 s 80 06 0200 0000 0020 32 <
f6130e00 1128133973 C Ci:1:012:0 0 32 = 09022000 01010680 fa090400 00020806 50070705 01020002 00070581 02000200
f6130e00 1128134049 S Ci:1:012:0 s 80 06 0300 0000 00ff 255 <
f6130e00 1128134223 C Ci:1:012:0 0 4 = 04030904
f6130e00 1128134262 S Ci:1:012:0 s 80 06 0302 0409 00ff 255 <
f6130e00 1128134347 C Ci:1:012:0 0 12 = 0c035000 68006f00 6e006500
f6130e00 1128134390 S Ci:1:012:0 s 80 06 0303 0409 00ff 255 <
f6130e00 1128134478 C Ci:1:012:0 0 28 = 1c034d00 6f007400 6f007200 6f006c00 61002000 49006e00 63002e00
f6130e00 1128134530 S Ci:1:012:0 s 80 06 0305 0409 00ff 255 <
f6130e00 1128134603 C Ci:1:012:0 0 26 = 1a033000 30003000 30003000 30003000 30003000 30003000 3000
f6130e00 1128137422 S Co:1:012:0 s 00 09 0001 0000 0000 0
f6130e00 1128137593 C Co:1:012:0 0 0
f6130e00 1128137648 S Ci:1:012:0 s 80 06 0306 0409 00ff 255 <
f6130e00 1128137840 C Ci:1:012:0 0 62 = 3e035500 53004200 20004d00 61007300 73002000 53007400 6f007200 61006700
f6130f00 1128144071 S Ci:1:012:0 s 80 06 0307 0409 00ff 255 <
f6130f00 1128144339 C Ci:1:012:0 0 56 = 38034d00 61007300 73002000 53007400 6f007200 61006700 65002000 44006100
f6130e80 1133143447 S Ci:1:012:0 s a1 fe 0000 0000 0001 1 <
f6130e80 1133143720 C Ci:1:012:0 0 1 = 00
f6130e80 1133144275 S Bo:1:012:1 -115 31 = 55534243 01000000 24000000 80000612 00000024 00000000 00000000 000000
f6130e80 1133144342 C Bo:1:012:1 0 31 >
f6130c80 1133144386 S Bi:1:012:1 -115 36 <
f6130c80 1133144499 C Bi:1:012:1 0 36 = 00800402 20000000 4d6f746f 726f6c61 50686f6e 65202020 20202020 20202020
f6130e80 1133144565 S Bi:1:012:1 -115 13 <
f6130e80 1133144727 C Bi:1:012:1 0 13 = 55534253 01000000 00000000 00
f6130e80 1133149734 S Bo:1:012:1 -115 31 = 55534243 02000000 00000000 00000600 00000000 00000000 00000000 000000
f6130e80 1133149845 C Bo:1:012:1 0 31 >
f6130e80 1133149892 S Bi:1:012:1 -115 13 <
f6130e80 1133150089 C Bi:1:012:1 0 13 = 55534253 02000000 00000000 00
f6130e80 1133150354 S Bo:1:012:1 -115 31 = 55534243 03000000 08000000 80000a25 00000000 00000000 00000000 000000
f6130e80 1133150465 C Bo:1:012:1 0 31 >
f6130300 1133150512 S Bi:1:012:1 -115 8 <
f6130300 1133150588 C Bi:1:012:1 0 8 = 003a9dff 00000200
f6130e80 1133150623 S Bi:1:012:1 -115 13 <
f6130e80 1133150714 C Bi:1:012:1 0 13 = 55534253 03000000 00000000 00
f6130e80 1133150872 S Bo:1:012:1 -115 31 = 55534243 04000000 c0000000 8000061a 003f00c0 00000000 00000000 000000
f6130e80 1133150964 C Bo:1:012:1 0 31 >
f6130300 1133151010 S Bi:1:012:1 -115 192 <
f6130300 1133151088 C Bi:1:012:1 -121 17 = 10000000 860b0002 0000003a 9e000003 00
f6130e80 1133151138 S Bi:1:012:1 -115 13 <
f6130e80 1133151339 C Bi:1:012:1 0 13 = 55534253 04000000 af000000 00
f6130e80 1133151581 S Bo:1:012:1 -115 31 = 55534243 05000000 00000000 00000600 00000000 00000000 00000000 000000
f6130e80 1133151723 C Bo:1:012:1 0 31 >
f6130e80 1133151763 S Bi:1:012:1 -115 13 <
f6130e80 1133151847 C Bi:1:012:1 0 13 = 55534253 05000000 00000000 00
f6130e80 1133151951 S Bo:1:012:1 -115 31 = 55534243 06000000 00000000 0000061e 00000001 00000000 00000000 000000
f6130e80 1133152097 C Bo:1:012:1 0 31 >
f6130e80 1133152133 S Bi:1:012:1 -115 13 <
f6130e80 1133152222 C Bi:1:012:1 0 13 = 55534253 06000000 00000000 00
f6130e80 1133152326 S Bo:1:012:1 -115 31 = 55534243 07000000 00000000 00000600 00000000 00000000 00000000 000000
f6130e80 1133152472 C Bo:1:012:1 0 31 >
f6130e80 1133152509 S Bi:1:012:1 -115 13 <
f6130e80 1133152597 C Bi:1:012:1 0 13 = 55534253 07000000 00000000 00
f6130e80 1133157465 S Bo:1:012:1 -115 31 = 55534243 08000000 08000000 80000a25 00000000 00000000 00000000 000000
f6130e80 1133157596 C Bo:1:012:1 0 31 >
f6130400 1133158595 S Bi:1:012:1 -115 8 <
f6130400 1133158719 C Bi:1:012:1 0 8 = 003a9dff 00000200
f6130e80 1133158787 S Bi:1:012:1 -115 13 <
f6130e80 1133158849 C Bi:1:012:1 0 13 = 55534253 08000000 00000000 00
f6130e80 1133158962 S Bo:1:012:1 -115 31 = 55534243 09000000 c0000000 8000061a 003f00c0 00000000 00000000 000000
f6130e80 1133159098 C Bo:1:012:1 0 31 >
f6130400 1133159138 S Bi:1:012:1 -115 192 <
f6130400 1133159218 C Bi:1:012:1 -121 17 = 10000000 860b0002 0000003a 9e000003 00
f6130e80 1133159589 S Bi:1:012:1 -115 13 <
f6130e80 1133159723 C Bi:1:012:1 0 13 = 55534253 09000000 af000000 00
f6130e80 1133159869 S Bo:1:012:1 -115 31 = 55534243 0a000000 00100000 80000a28 00000000 00000008 00000000 000000
f6130e80 1133159972 C Bo:1:012:1 0 31 >
f6130400 1133160011 S Bi:1:012:1 -115 4096 <
f6130400 1133161347 C Bi:1:012:1 0 4096 = fa31c08e d88ed0bc 007c89e6 0657528e c0fbfcbf 0006b900 01f3a5ea 20060000
f6130e80 1133163617 S Bi:1:012:1 -115 13 <
f6130e80 1133163724 C Bi:1:012:1 0 13 = 55534253 0a000000 00000000 00
f6130e80 1133163958 S Bo:1:012:1 -115 31 = 55534243 0b000000 00000000 0000061e 00000000 00000000 00000000 000000
f6130e80 1133164098 C Bo:1:012:1 0 31 >
f6130e80 1133164137 S Bi:1:012:1 -115 13 <
f6130e80 1133164223 C Bi:1:012:1 0 13 = 55534253 0b000000 00000000 00
f6130e80 1133217225 S Bo:1:012:1 -115 31 = 55534243 0c000000 00000000 00000600 00000000 00000000 00000000 000000
f6130e80 1133217343 C Bo:1:012:1 0 31 >
f6130e80 1133217669 S Bi:1:012:1 -115 13 <
f6130e80 1133217848 C Bi:1:012:1 0 13 = 55534253 0c000000 00000000 00
f6130e80 1133221922 S Bo:1:012:1 -115 31 = 55534243 0d000000 00000000 0000061e 00000001 00000000 00000000 000000
f6130e80 1133221968 C Bo:1:012:1 0 31 >
f6130e80 1133222036 S Bi:1:012:1 -115 13 <
f6130e80 1133222089 C Bi:1:012:1 0 13 = 55534253 0d000000 00000000 00
f6130e80 1133226473 S Bo:1:012:1 -115 31 = 55534243 0e000000 00400000 80000a28 00000000 00000020 00000000 000000
f6130e80 1133226609 C Bo:1:012:1 0 31 >
f6130d80 1133226657 S Bi:1:012:1 -115 4096 <
f6130d00 1133226665 S Bi:1:012:1 -115 4096 <
f6130000 1133226670 S Bi:1:012:1 -115 4096 <
f6130c80 1133226675 S Bi:1:012:1 -115 4096 <
f6130d80 1133230343 C Bi:1:012:1 0 4096 = fa31c08e d88ed0bc 007c89e6 0657528e c0fbfcbf 0006b900 01f3a5ea 20060000
f6130d00 1133230355 C Bi:1:012:1 0 4096 = ffffffff ffffffff ffffffff ffffffff ffffffff ffffffff ffffffff ffffffff
f6130000 1133230360 C Bi:1:012:1 0 4096 = ffffffff ffffffff ffffffff ffffffff ffffffff ffffffff ffffffff ffffffff
f6130c80 1133230364 C Bi:1:012:1 0 4096 = ffffffff ffffffff ffffffff ffffffff ffffffff ffffffff ffffffff ffffffff
f6130e80 1133231351 S Bi:1:012:1 -115 13 <
f6130e80 1133231474 C Bi:1:012:1 0 13 = 55534253 0e000000 00000000 00
f6130e80 1133231655 S Bo:1:012:1 -115 31 = 55534243 0f000000 00100000 80000a28 00003a9d 80000008 00000000 000000
f6130e80 1133231724 C Bo:1:012:1 0 31 >
f6130400 1133231767 S Bi:1:012:1 -115 4096 <
f6130400 1133233342 C Bi:1:012:1 0 4096 = ffffffff ffffffff ffffffff ffffffff ffffffff ffffffff ffffffff ffffffff
f6130e80 1133233938 S Bi:1:012:1 -115 13 <
f6130e80 1133234098 C Bi:1:012:1 0 13 = 55534253 0f000000 00000000 00
f6130e80 1133234247 S Bo:1:012:1 -115 31 = 55534243 10000000 00100000 80000a28 00003a9d f0000008 00000000 000000
f6130e80 1133234348 C Bo:1:012:1 0 31 >
f6130400 1133234390 S Bi:1:012:1 -115 4096 <
f6130400 1133235722 C Bi:1:012:1 0 4096 = ffffffff ffffffff ffffffff ffffffff ffffffff ffffffff ffffffff ffffffff
f6130e80 1133235771 S Bi:1:012:1 -115 13 <
f6130e80 1133235846 C Bi:1:012:1 0 13 = 55534253 10000000 00000000 00
f6130e80 1133236028 S Bo:1:012:1 -115 31 = 55534243 11000000 00020000 80000a28 00003a9d f8000001 00000000 000000
f6130e80 1133236098 C Bo:1:012:1 0 31 >
f6130380 1133236138 S Bi:1:012:1 -115 512 <
f6130380 1133236972 C Bi:1:012:1 0 512 = ffffffff ffffffff ffffffff ffffffff ffffffff ffffffff ffffffff ffffffff
f6130e80 1133237019 S Bi:1:012:1 -115 13 <
f6130e80 1133237097 C Bi:1:012:1 0 13 = 55534253 11000000 00000000 00
f6130e80 1133237161 S Bo:1:012:1 -115 31 = 55534243 12000000 00020000 80000a28 00003a9d f9000001 00000000 000000
f6130e80 1133237223 C Bo:1:012:1 0 31 >
f6130380 1133237261 S Bi:1:012:1 -115 512 <
f6130380 1133237596 C Bi:1:012:1 0 512 = ffffffff ffffffff ffffffff ffffffff ffffffff ffffffff ffffffff ffffffff
f6130e80 1133237645 S Bi:1:012:1 -115 13 <
f6130e80 1133237722 C Bi:1:012:1 0 13 = 55534253 12000000 00000000 00
f6130e80 1133237786 S Bo:1:012:1 -115 31 = 55534243 13000000 00020000 80000a28 00003a9d fa000001 00000000 000000
f6130e80 1133237848 C Bo:1:012:1 0 31 >
f6130380 1133237885 S Bi:1:012:1 -115 512 <
f6130380 1133238222 C Bi:1:012:1 0 512 = ffffffff ffffffff ffffffff ffffffff ffffffff ffffffff ffffffff ffffffff
f6130e80 1133238269 S Bi:1:012:1 -115 13 <
f6130e80 1133238347 C Bi:1:012:1 0 13 = 55534253 13000000 00000000 00
f6130e80 1133238410 S Bo:1:012:1 -115 31 = 55534243 14000000 00020000 80000a28 00003a9d fb000001 00000000 000000
f6130e80 1133238472 C Bo:1:012:1 0 31 >
f6130380 1133238510 S Bi:1:012:1 -115 512 <
f6130380 1133238847 C Bi:1:012:1 0 512 = ffffffff ffffffff ffffffff ffffffff ffffffff ffffffff ffffffff ffffffff
f6130e80 1133238893 S Bi:1:012:1 -115 13 <
f6130e80 1133238973 C Bi:1:012:1 0 13 = 55534253 14000000 00000000 00
f6130e80 1133239035 S Bo:1:012:1 -115 31 = 55534243 15000000 00020000 80000a28 00003a9d fc000001 00000000 000000
f6130e80 1133239096 C Bo:1:012:1 0 31 >
f6130380 1133239134 S Bi:1:012:1 -115 512 <
f6130380 1133239348 C Bi:1:012:1 0 512 = ffffffff ffffffff ffffffff ffffffff ffffffff ffffffff ffffffff ffffffff
f6130e80 1133239393 S Bi:1:012:1 -115 13 <
f6130e80 1133239472 C Bi:1:012:1 0 13 = 55534253 15000000 00000000 00
f6130e80 1133239534 S Bo:1:012:1 -115 31 = 55534243 16000000 00020000 80000a28 00003a9d fd000001 00000000 000000
f6130e80 1133239597 C Bo:1:012:1 0 31 >
f6130380 1133239635 S Bi:1:012:1 -115 512 <
f6130380 1133239964 C Bi:1:012:1 0 512 = ffffffff ffffffff ffffffff ffffffff ffffffff ffffffff ffffffff ffffffff
f6130e80 1133240135 S Bi:1:012:1 -115 13 <
f6130e80 1133240223 C Bi:1:012:1 0 13 = 55534253 16000000 00000000 00
f6130e80 1133240292 S Bo:1:012:1 -115 31 = 55534243 17000000 00020000 80000a28 00003a9d fe000001 00000000 000000
f6130e80 1133240345 C Bo:1:012:1 0 31 >
f6130380 1133240394 S Bi:1:012:1 -115 512 <
f6130380 1133240597 C Bi:1:012:1 0 512 = ffffffff ffffffff ffffffff ffffffff ffffffff ffffffff ffffffff ffffffff
f6130e80 1133240644 S Bi:1:012:1 -115 13 <
f6130e80 1133240722 C Bi:1:012:1 0 13 = 55534253 17000000 00000000 00
f6130e80 1133240785 S Bo:1:012:1 -115 31 = 55534243 18000000 00020000 80000a28 00003a9d ff000001 00000000 000000
f6130e80 1133240847 C Bo:1:012:1 0 31 >
f6130380 1133240919 S Bi:1:012:1 -115 512 <
f6130380 1133241213 C Bi:1:012:1 0 512 = ffffffff ffffffff ffffffff ffffffff ffffffff ffffffff ffffffff ffffffff
f6130e80 1133241967 S Bi:1:012:1 -115 13 <
f6130e80 1133242098 C Bi:1:012:1 0 13 = 55534253 18000000 00000000 00
f6130e80 1133242228 S Bo:1:012:1 -115 31 = 55534243 19000000 00800000 80000a28 00000000 20000040 00000000 000000
f6130e80 1133242347 C Bo:1:012:1 0 31 >
f6130380 1133242392 S Bi:1:012:1 -115 4096 <
f6130100 1133242400 S Bi:1:012:1 -115 4096 <
f6130f00 1133242405 S Bi:1:012:1 -115 4096 <
f6130180 1133242409 S Bi:1:012:1 -115 4096 <
f6130200 1133242414 S Bi:1:012:1 -115 4096 <
f6130280 1133242418 S Bi:1:012:1 -115 4096 <
f6130800 1133242423 S Bi:1:012:1 -115 4096 <
f6130b00 1133242427 S Bi:1:012:1 -115 4096 <
f6130380 1133249215 C Bi:1:012:1 0 4096 = ffffffff ffffffff ffffffff ffffffff ffffffff ffffffff ffffffff ffffffff
f6130100 1133249224 C Bi:1:012:1 0 4096 = ffffffff ffffffff ffffffff ffffffff ffffffff ffffffff ffffffff ffffffff
f6130f00 1133249229 C Bi:1:012:1 0 4096 = ffffffff ffffffff ffffffff ffffffff ffffffff ffffffff ffffffff ffffffff
f6130180 1133249233 C Bi:1:012:1 0 4096 = ffffffff ffffffff ffffffff ffffffff ffffffff ffffffff ffffffff ffffffff
f6130200 1133249238 C Bi:1:012:1 0 4096 = ffffffff ffffffff ffffffff ffffffff ffffffff ffffffff ffffffff ffffffff
f6130280 1133249242 C Bi:1:012:1 0 4096 = ffffffff ffffffff ffffffff ffffffff ffffffff ffffffff ffffffff ffffffff
f6130800 1133249246 C Bi:1:012:1 0 4096 = ffffffff ffffffff ffffffff ffffffff ffffffff ffffffff ffffffff ffffffff
f6130b00 1133249251 C Bi:1:012:1 0 4096 = ffffffff ffffffff ffffffff ffffffff ffffffff ffffffff ffffffff ffffffff
f6130e80 1133249582 S Bi:1:012:1 -115 13 <
f6130e80 1133249723 C Bi:1:012:1 0 13 = 55534253 19000000 00000000 00
f6130e80 1133249813 S Bo:1:012:1 -115 31 = 55534243 1a000000 00100000 80000a28 00003a9c f8000008 00000000 000000
f6130e80 1133249971 C Bo:1:012:1 0 31 >
f6130b80 1133250010 S Bi:1:012:1 -115 4096 <
f6130b80 1133252473 C Bi:1:012:1 0 4096 = ffffffff ffffffff ffffffff ffffffff ffffffff ffffffff ffffffff ffffffff
f6130e80 1133252719 S Bi:1:012:1 -115 13 <
f6130e80 1133252847 C Bi:1:012:1 0 13 = 55534253 1a000000 00000000 00
f6130e80 1133252976 S Bo:1:012:1 -115 31 = 55534243 1b000000 00100000 80000a28 00003a9d c0000008 00000000 000000
f6130e80 1133253089 C Bo:1:012:1 0 31 >
f6130b80 1133253815 S Bi:1:012:1 -115 4096 <
f6130b80 1133254473 C Bi:1:012:1 0 4096 = ffffffff ffffffff ffffffff ffffffff ffffffff ffffffff ffffffff ffffffff
f6130e80 1133254530 S Bi:1:012:1 -115 13 <
f6130e80 1133254597 C Bi:1:012:1 0 13 = 55534253 1b000000 00000000 00
f6130e80 1133254712 S Bo:1:012:1 -115 31 = 55534243 1c000000 00100000 80000a28 00003a9d 00000008 00000000 000000
f6130e80 1133254847 C Bo:1:012:1 0 31 >
f6130b80 1133254887 S Bi:1:012:1 -115 4096 <
f6130b80 1133256475 C Bi:1:012:1 0 4096 = ffffffff ffffffff ffffffff ffffffff ffffffff ffffffff ffffffff ffffffff
f6130e80 1133256542 S Bi:1:012:1 -115 13 <
f6130e80 1133256598 C Bi:1:012:1 0 13 = 55534253 1c000000 00000000 00
f6130e80 1133256728 S Bo:1:012:1 -115 31 = 55534243 1d000000 00100000 80000a28 00003a9c 70000008 00000000 000000
f6130e80 1133256847 C Bo:1:012:1 0 31 >
f6130b80 1133256888 S Bi:1:012:1 -115 4096 <
f6130b80 1133258346 C Bi:1:012:1 0 4096 = ffffffff ffffffff ffffffff ffffffff ffffffff ffffffff ffffffff ffffffff
f6130e80 1133259672 S Bi:1:012:1 -115 13 <
f6130e80 1133259717 C Bi:1:012:1 0 13 = 55534253 1d000000 00000000 00
f6130e80 1133260307 S Bo:1:012:1 -115 31 = 55534243 1e000000 00e00100 80000a28 00000000 600000f0 00000000 000000
f6130e80 1133260338 C Bo:1:012:1 0 31 >
d6460f00 1133260399 S Bi:1:012:1 -115 4096 <
d6460a80 1133260407 S Bi:1:012:1 -115 4096 <
d6460c00 1133260412 S Bi:1:012:1 -115 4096 <
d6460680 1133260416 S Bi:1:012:1 -115 4096 <
d6460d80 1133260421 S Bi:1:012:1 -115 4096 <
d6460e00 1133260425 S Bi:1:012:1 -115 4096 <
d6460e80 1133260429 S Bi:1:012:1 -115 4096 <
d6460600 1133260434 S Bi:1:012:1 -115 4096 <
d6460880 1133260438 S Bi:1:012:1 -115 4096 <
d6460780 1133260443 S Bi:1:012:1 -115 4096 <
d6460480 1133260447 S Bi:1:012:1 -115 4096 <
d6460900 1133260451 S Bi:1:012:1 -115 4096 <
d6460800 1133260455 S Bi:1:012:1 -115 4096 <
d6460000 1133260460 S Bi:1:012:1 -115 4096 <
d6460080 1133260464 S Bi:1:012:1 -115 4096 <
d6460200 1133260468 S Bi:1:012:1 -115 4096 <
d6460b80 1133260473 S Bi:1:012:1 -115 4096 <
d6460a00 1133260477 S Bi:1:012:1 -115 4096 <
d6460980 1133260481 S Bi:1:012:1 -115 4096 <
d6460100 1133260486 S Bi:1:012:1 -115 4096 <
d6460380 1133260490 S Bi:1:012:1 -115 4096 <
e4556d00 1133260495 S Bi:1:012:1 -115 4096 <
e4556c80 1133260500 S Bi:1:012:1 -115 4096 <
e4556b00 1133260504 S Bi:1:012:1 -115 4096 <
e4556100 1133260508 S Bi:1:012:1 -115 4096 <
e4556900 1133260513 S Bi:1:012:1 -115 4096 <
e4556680 1133260524 S Bi:1:012:1 -115 4096 <
e4556480 1133260528 S Bi:1:012:1 -115 4096 <
e4556180 1133260533 S Bi:1:012:1 -115 4096 <
e4556700 1133260537 S Bi:1:012:1 -115 4096 <
d6460f00 1133285232 C Bi:1:012:1 0 4096 = ffffffff ffffffff ffffffff ffffffff ffffffff ffffffff ffffffff ffffffff
d6460a80 1133285244 C Bi:1:012:1 0 4096 = ffffffff ffffffff ffffffff ffffffff ffffffff ffffffff ffffffff ffffffff
d6460c00 1133285249 C Bi:1:012:1 0 4096 = ffffffff ffffffff ffffffff ffffffff ffffffff ffffffff ffffffff ffffffff
d6460680 1133285253 C Bi:1:012:1 0 4096 = ffffffff ffffffff ffffffff ffffffff ffffffff ffffffff ffffffff ffffffff
d6460d80 1133285258 C Bi:1:012:1 0 4096 = ffffffff ffffffff ffffffff ffffffff ffffffff ffffffff ffffffff ffffffff
d6460e00 1133285262 C Bi:1:012:1 0 4096 = ffffffff ffffffff ffffffff ffffffff ffffffff ffffffff ffffffff ffffffff
d6460e80 1133285267 C Bi:1:012:1 0 4096 = 00000000 00000000 00000000 00000000 00000000 00000000 00000000 00000000
d6460600 1133285272 C Bi:1:012:1 0 4096 = 00000000 00000000 00000000 00000000 00000000 00000000 00000000 00000000
d6460880 1133285276 C Bi:1:012:1 0 4096 = 00000000 00000000 00000000 00000000 00000000 00000000 00000000 00000000
d6460780 1133285281 C Bi:1:012:1 0 4096 = 00000000 00000000 00000000 00000000 00000000 00000000 00000000 00000000
d6460480 1133285285 C Bi:1:012:1 0 4096 = 00000000 00000000 00000000 00000000 00000000 00000000 00000000 00000000
d6460900 1133285289 C Bi:1:012:1 0 4096 = 00000000 00000000 00000000 00000000 00000000 00000000 00000000 00000000
d6460800 1133285294 C Bi:1:012:1 0 4096 = 00000000 00000000 00000000 00000000 00000000 00000000 00000000 00000000
d6460000 1133285299 C Bi:1:012:1 0 4096 = 00000000 00000000 00000000 00000000 00000000 00000000 00000000 00000000
d6460080 1133285303 C Bi:1:012:1 0 4096 = 00000000 00000000 00000000 00000000 00000000 00000000 00000000 00000000
d6460200 1133285308 C Bi:1:012:1 0 4096 = 00000000 00000000 00000000 00000000 00000000 00000000 00000000 00000000
d6460b80 1133285313 C Bi:1:012:1 0 4096 = 00000000 00000000 00000000 00000000 00000000 00000000 00000000 00000000
d6460a00 1133285317 C Bi:1:012:1 0 4096 = 00000000 00000000 00000000 00000000 00000000 00000000 00000000 00000000
d6460980 1133285322 C Bi:1:012:1 0 4096 = 00000000 00000000 00000000 00000000 00000000 00000000 00000000 00000000
d6460100 1133285327 C Bi:1:012:1 0 4096 = 00000000 00000000 00000000 00000000 00000000 00000000 00000000 00000000
d6460380 1133285331 C Bi:1:012:1 0 4096 = 00000000 00000000 00000000 00000000 00000000 00000000 00000000 00000000
e4556d00 1133285336 C Bi:1:012:1 0 4096 = 00000000 00000000 00000000 00000000 00000000 00000000 00000000 00000000
e4556c80 1133285341 C Bi:1:012:1 0 4096 = 00000000 00000000 00000000 00000000 00000000 00000000 00000000 00000000
e4556b00 1133285345 C Bi:1:012:1 0 4096 = 00000000 00000000 00000000 00000000 00000000 00000000 00000000 00000000
e4556100 1133285349 C Bi:1:012:1 0 4096 = 00000000 00000000 00000000 00000000 00000000 00000000 00000000 00000000
e4556900 1133285354 C Bi:1:012:1 0 4096 = 00000000 00000000 00000000 00000000 00000000 00000000 00000000 00000000
e4556680 1133285366 C Bi:1:012:1 0 4096 = 00000000 00000000 00000000 00000000 00000000 00000000 00000000 00000000
e4556480 1133285370 C Bi:1:012:1 0 4096 = 00000000 00000000 00000000 00000000 00000000 00000000 00000000 00000000
e4556180 1133285375 C Bi:1:012:1 0 4096 = 00000000 00000000 00000000 00000000 00000000 00000000 00000000 00000000
e4556700 1133285379 C Bi:1:012:1 0 4096 = 00000000 00000000 00000000 00000000 00000000 00000000 00000000 00000000
f6130e80 1133286281 S Bi:1:012:1 -115 13 <
f6130e80 1133286350 C Bi:1:012:1 0 13 = 55534253 1e000000 00000000 00
f6130e80 1133286732 S Bo:1:012:1 -115 31 = 55534243 1f000000 00200100 80000a28 00000001 50000090 00000000 000000
f6130e80 1133286854 C Bo:1:012:1 0 31 >
e4556b00 1133286907 S Bi:1:012:1 -115 8192 <
e4556100 1133286915 S Bi:1:012:1 -115 4096 <
e4556900 1133286919 S Bi:1:012:1 -115 4096 <
e4556680 1133286924 S Bi:1:012:1 -115 4096 <
e4556480 1133286928 S Bi:1:012:1 -115 4096 <
e4556180 1133286932 S Bi:1:012:1 -115 4096 <
e4556700 1133286936 S Bi:1:012:1 -115 4096 <
e4556f00 1133286940 S Bi:1:012:1 -115 4096 <
e4556e00 1133286945 S Bi:1:012:1 -115 4096 <
e4556e80 1133286949 S Bi:1:012:1 -115 4096 <
e4556600 1133286953 S Bi:1:012:1 -115 4096 <
e4556280 1133286957 S Bi:1:012:1 -115 4096 <
e4556a00 1133286962 S Bi:1:012:1 -115 4096 <
e4556380 1133286966 S Bi:1:012:1 -115 4096 <
e4556000 1133286971 S Bi:1:012:1 -115 4096 <
e4556580 1133286975 S Bi:1:012:1 -115 4096 <
e4556780 1133286979 S Bi:1:012:1 -115 4096 <
e4556b00 1133297357 C Bi:1:012:1 0 8192 = 00000000 00000000 00000000 00000000 00000000 00000000 00000000 00000000
e4556100 1133297366 C Bi:1:012:1 0 4096 = 00000000 00000000 00000000 00000000 00000000 00000000 00000000 00000000
e4556900 1133297370 C Bi:1:012:1 0 4096 = 00000000 00000000 00000000 00000000 00000000 00000000 00000000 00000000
e4556680 1133297375 C Bi:1:012:1 0 4096 = 00000000 00000000 00000000 00000000 00000000 00000000 00000000 00000000
e4556480 1133297379 C Bi:1:012:1 0 4096 = 00000000 00000000 00000000 00000000 00000000 00000000 00000000 00000000
e4556180 1133297383 C Bi:1:012:1 0 4096 = 00000000 00000000 00000000 00000000 00000000 00000000 00000000 00000000
e4556700 1133297387 C Bi:1:012:1 0 4096 = 00000000 00000000 00000000 00000000 00000000 00000000 00000000 00000000
e4556f00 1133297392 C Bi:1:012:1 0 4096 = 00000000 00000000 00000000 00000000 00000000 00000000 00000000 00000000
e4556e00 1133297396 C Bi:1:012:1 0 4096 = 00000000 00000000 00000000 00000000 00000000 00000000 00000000 00000000
e4556e80 1133297401 C Bi:1:012:1 0 4096 = 00000000 00000000 00000000 00000000 00000000 00000000 00000000 00000000
e4556600 1133297405 C Bi:1:012:1 0 4096 = 00000000 00000000 00000000 00000000 00000000 00000000 00000000 00000000
e4556280 1133297409 C Bi:1:012:1 0 4096 = 00000000 00000000 00000000 00000000 00000000 00000000 00000000 00000000
e4556a00 1133297414 C Bi:1:012:1 0 4096 = 00000000 00000000 00000000 00000000 00000000 00000000 00000000 00000000
e4556380 1133297418 C Bi:1:012:1 0 4096 = 00000000 00000000 00000000 00000000 00000000 00000000 00000000 00000000
e4556000 1133297423 C Bi:1:012:1 0 4096 = 00000000 00000000 00000000 00000000 00000000 00000000 00000000 00000000
e4556580 1133297427 C Bi:1:012:1 0 4096 = 00000000 00000000 00000000 00000000 00000000 00000000 00000000 00000000
e4556780 1133297431 C Bi:1:012:1 0 4096 = 00000000 00000000 00000000 00000000 00000000 00000000 00000000 00000000
f6130e80 1133298428 S Bi:1:012:1 -115 13 <
f6130e80 1133298590 C Bi:1:012:1 0 13 = 55534253 1f000000 00000000 00
f6130e80 1133298688 S Bo:1:012:1 -115 31 = 55534243 20000000 00100000 80000a28 00000002 00000008 00000000 000000
f6130e80 1133298840 C Bo:1:012:1 0 31 >
e4185800 1133298869 S Bi:1:012:1 -115 4096 <
e4185800 1133302605 C Bi:1:012:1 0 4096 = 00000000 00000000 00000000 00000000 00000000 00000000 00000000 00000000
f6130e80 1133302637 S Bi:1:012:1 -115 13 <
f6130e80 1133302730 C Bi:1:012:1 0 13 = 55534253 20000000 00000000 00
f6130e80 1133303377 S Bo:1:012:1 -115 31 = 55534243 21000000 00000000 0000061e 00000000 00000000 00000000 000000
f6130e80 1133303465 C Bo:1:012:1 0 31 >
f6130e80 1133303491 S Bi:1:012:1 -115 13 <
f6130e80 1133303603 C Bi:1:012:1 0 13 = 55534253 21000000 00000000 00
f6130e80 1133343736 S Bo:1:012:1 -115 31 = 55534243 22000000 00000000 00000600 00000000 00000000 00000000 000000
f6130e80 1133343843 C Bo:1:012:1 0 31 >
f6130e80 1133343865 S Bi:1:012:1 -115 13 <
f6130e80 1133344090 C Bi:1:012:1 0 13 = 55534253 22000000 00000000 00
f6130e80 1133344285 S Bo:1:012:1 -115 31 = 55534243 23000000 00000000 0000061e 00000001 00000000 00000000 000000
f6130e80 1133344341 C Bo:1:012:1 0 31 >
f6130e80 1133344368 S Bi:1:012:1 -115 13 <
f6130e80 1133344478 C Bi:1:012:1 0 13 = 55534253 23000000 00000000 00
f6130e80 1133344584 S Bo:1:012:1 -115 31 = 55534243 24000000 00000000 00000600 00000000 00000000 00000000 000000
f6130e80 1133344715 C Bo:1:012:1 0 31 >
f6130e80 1133344747 S Bi:1:012:1 -115 13 <
f6130e80 1133344849 C Bi:1:012:1 0 13 = 55534253 24000000 00000000 00
f6130e80 1133344937 S Bo:1:012:1 -115 31 = 55534243 25000000 00000000 00000600 00000000 00000000 00000000 000000
f6130e80 1133344965 C Bo:1:012:1 0 31 >
f6130e80 1133344980 S Bi:1:012:1 -115 13 <
f6130e80 1133345097 C Bi:1:012:1 0 13 = 55534253 25000000 00000000 00
f6130e80 1133345230 S Bo:1:012:1 -115 31 = 55534243 26000000 00400000 80000a28 00000000 00000020 00000000 000000
f6130e80 1133345348 C Bo:1:012:1 0 31 >
e4185f00 1133345373 S Bi:1:012:1 -115 4096 <
e4185c80 1133345380 S Bi:1:012:1 -115 4096 <
e4185400 1133345384 S Bi:1:012:1 -115 4096 <
e4185e00 1133345388 S Bi:1:012:1 -115 4096 <
e4185f00 1133349103 C Bi:1:012:1 0 4096 = fa31c08e d88ed0bc 007c89e6 0657528e c0fbfcbf 0006b900 01f3a5ea 20060000
e4185c80 1133349112 C Bi:1:012:1 0 4096 = ffffffff ffffffff ffffffff ffffffff ffffffff ffffffff ffffffff ffffffff
e4185400 1133349118 C Bi:1:012:1 0 4096 = ffffffff ffffffff ffffffff ffffffff ffffffff ffffffff ffffffff ffffffff
e4185e00 1133349122 C Bi:1:012:1 0 4096 = ffffffff ffffffff ffffffff ffffffff ffffffff ffffffff ffffffff ffffffff
f6130e80 1133349158 S Bi:1:012:1 -115 13 <
f6130e80 1133349214 C Bi:1:012:1 0 13 = 55534253 26000000 00000000 00
f6130e80 1133351283 S Bo:1:012:1 -115 31 = 55534243 27000000 00400000 80000a28 00000000 89000020 00000000 000000
f6130e80 1133351342 C Bo:1:012:1 0 31 >
ee2c4800 1133351376 S Bi:1:012:1 -115 4096 <
ee2c4180 1133351383 S Bi:1:012:1 -115 4096 <
ee2c4f00 1133351387 S Bi:1:012:1 -115 4096 <
ee2c4600 1133351392 S Bi:1:012:1 -115 4096 <
ee2c4800 1133355215 C Bi:1:012:1 0 4096 = eb58906d 6b646f73 66730000 02082000 02000000 00f80000 10000400 10000000
ee2c4180 1133355223 C Bi:1:012:1 0 4096 = 00000000 00000000 00000000 00000000 00000000 00000000 00000000 00000000
ee2c4f00 1133355228 C Bi:1:012:1 0 4096 = 00000000 00000000 00000000 00000000 00000000 00000000 00000000 00000000
ee2c4600 1133355232 C Bi:1:012:1 0 4096 = 00000000 00000000 00000000 00000000 00000000 00000000 00000000 00000000
f6130e80 1133357779 S Bi:1:012:1 -115 13 <
f6130e80 1133357854 C Bi:1:012:1 0 13 = 55534253 27000000 00000000 00
f6130e80 1133367900 S Bo:1:012:1 -115 31 = 55534243 28000000 00020000 80000a28 00003a9d 09000001 00000000 000000
f6130e80 1133367967 C Bo:1:012:1 0 31 >
e4556980 1133368404 S Bi:1:012:1 -115 512 <
e4556980 1133368726 C Bi:1:012:1 0 512 = ffffffff ffffffff ffffffff ffffffff ffffffff ffffffff ffffffff ffffffff
f6130e80 1133368781 S Bi:1:012:1 -115 13 <
f6130e80 1133368847 C Bi:1:012:1 0 13 = 55534253 28000000 00000000 00
f6130e80 1133368929 S Bo:1:012:1 -115 31 = 55534243 29000000 000e0000 80000a28 00003a9d 0a000007 00000000 000000
f6130e80 1133368963 C Bo:1:012:1 0 31 >
e4556800 1133369000 S Bi:1:012:1 -115 3584 <
e4556800 1133370471 C Bi:1:012:1 0 3584 = ffffffff ffffffff ffffffff ffffffff ffffffff ffffffff ffffffff ffffffff
f6130e80 1133370520 S Bi:1:012:1 -115 13 <
f6130e80 1133370598 C Bi:1:012:1 0 13 = 55534253 29000000 00000000 00
f6130e80 1133370741 S Bo:1:012:1 -115 31 = 55534243 2a000000 00100000 80000a28 00003a9d e9000008 00000000 000000
f6130e80 1133370848 C Bo:1:012:1 0 31 >
e4556500 1133370888 S Bi:1:012:1 -115 4096 <
e4556500 1133372347 C Bi:1:012:1 0 4096 = ffffffff ffffffff ffffffff ffffffff ffffffff ffffffff ffffffff ffffffff
f6130e80 1133372393 S Bi:1:012:1 -115 13 <
f6130e80 1133372472 C Bi:1:012:1 0 13 = 55534253 2a000000 00000000 00
f6130e80 1133372792 S Bo:1:012:1 -115 31 = 55534243 2b000000 00020000 80000a28 00003a9d f9000001 00000000 000000
f6130e80 1133372840 C Bo:1:012:1 0 31 >
e46cdf00 1133372901 S Bi:1:012:1 -115 512 <
e46cdf00 1133373597 C Bi:1:012:1 0 512 = ffffffff ffffffff ffffffff ffffffff ffffffff ffffffff ffffffff ffffffff
f6130e80 1133373646 S Bi:1:012:1 -115 13 <
f6130e80 1133373722 C Bi:1:012:1 0 13 = 55534253 2b000000 00000000 00
f6130e80 1133373789 S Bo:1:012:1 -115 31 = 55534243 2c000000 00020000 80000a28 00003a9d fa000001 00000000 000000
f6130e80 1133373841 C Bo:1:012:1 0 31 >
e46cd180 1133373877 S Bi:1:012:1 -115 512 <
e46cd180 1133374096 C Bi:1:012:1 0 512 = ffffffff ffffffff ffffffff ffffffff ffffffff ffffffff ffffffff ffffffff
f6130e80 1133374142 S Bi:1:012:1 -115 13 <
f6130e80 1133374221 C Bi:1:012:1 0 13 = 55534253 2c000000 00000000 00
f6130e80 1133374286 S Bo:1:012:1 -115 31 = 55534243 2d000000 00020000 80000a28 00003a9d fb000001 00000000 000000
f6130e80 1133374347 C Bo:1:012:1 0 31 >
e46cd780 1133374385 S Bi:1:012:1 -115 512 <
e46cd780 1133374722 C Bi:1:012:1 0 512 = ffffffff ffffffff ffffffff ffffffff ffffffff ffffffff ffffffff ffffffff
f6130e80 1133374768 S Bi:1:012:1 -115 13 <
f6130e80 1133374847 C Bi:1:012:1 0 13 = 55534253 2d000000 00000000 00
f6130e80 1133374926 S Bo:1:012:1 -115 31 = 55534243 2e000000 00020000 80000a28 00003a9d fc000001 00000000 000000
f6130e80 1133374964 C Bo:1:012:1 0 31 >
e46cd500 1133374995 S Bi:1:012:1 -115 512 <
e46cd500 1133375346 C Bi:1:012:1 0 512 = ffffffff ffffffff ffffffff ffffffff ffffffff ffffffff ffffffff ffffffff
f6130e80 1133375393 S Bi:1:012:1 -115 13 <
f6130e80 1133375472 C Bi:1:012:1 0 13 = 55534253 2e000000 00000000 00
f6130e80 1133375536 S Bo:1:012:1 -115 31 = 55534243 2f000000 00020000 80000a28 00003a9d fd000001 00000000 000000
f6130e80 1133375598 C Bo:1:012:1 0 31 >
e46cdc80 1133375636 S Bi:1:012:1 -115 512 <
e46cdc80 1133375963 C Bi:1:012:1 0 512 = ffffffff ffffffff ffffffff ffffffff ffffffff ffffffff ffffffff ffffffff
f6130e80 1133376012 S Bi:1:012:1 -115 13 <
f6130e80 1133376089 C Bi:1:012:1 0 13 = 55534253 2f000000 00000000 00
f6130e80 1133376159 S Bo:1:012:1 -115 31 = 55534243 30000000 00020000 80000a28 00003a9d fe000001 00000000 000000
f6130e80 1133376213 C Bo:1:012:1 0 31 >
e46cdb00 1133376250 S Bi:1:012:1 -115 512 <
e46cdb00 1133376590 C Bi:1:012:1 0 512 = ffffffff ffffffff ffffffff ffffffff ffffffff ffffffff ffffffff ffffffff
f6130e80 1133378107 S Bi:1:012:1 -115 13 <
f6130e80 1133378215 C Bi:1:012:1 0 13 = 55534253 30000000 00000000 00
f6130e80 1133378290 S Bo:1:012:1 -115 31 = 55534243 31000000 00020000 80000a28 00003a9d ff000001 00000000 000000
f6130e80 1133378338 C Bo:1:012:1 0 31 >
e46cd000 1133378374 S Bi:1:012:1 -115 512 <
e46cd000 1133378462 C Bi:1:012:1 0 512 = ffffffff ffffffff ffffffff ffffffff ffffffff ffffffff ffffffff ffffffff
f6130e80 1133378506 S Bi:1:012:1 -115 13 <
f6130e80 1133378588 C Bi:1:012:1 0 13 = 55534253 31000000 00000000 00
f6130e80 1133378660 S Bo:1:012:1 -115 31 = 55534243 32000000 00800000 80000a28 00000000 a9000040 00000000 000000
f6130e80 1133378713 C Bo:1:012:1 0 31 >
e46cdd00 1133378754 S Bi:1:012:1 -115 4096 <
e46cdb80 1133378761 S Bi:1:012:1 -115 4096 <
e46cd000 1133378766 S Bi:1:012:1 -115 4096 <
e46cdb00 1133378770 S Bi:1:012:1 -115 4096 <
e46cdc80 1133378775 S Bi:1:012:1 -115 4096 <
e46cd500 1133378780 S Bi:1:012:1 -115 4096 <
e46cd780 1133378784 S Bi:1:012:1 -115 4096 <
e46cd180 1133378788 S Bi:1:012:1 -115 4096 <
e46cdd00 1133385968 C Bi:1:012:1 0 4096 = f8ffff0f ffffffff de4b0500 ffffff0f ffffff0f ffffff0f 07000000 ffffff0f
e46cdb80 1133385980 C Bi:1:012:1 0 4096 = 00000000 00000000 00000000 00000000 00000000 00000000 00000000 00000000
e46cd000 1133385985 C Bi:1:012:1 0 4096 = 00000000 00000000 00000000 00000000 00000000 00000000 00000000 00000000
e46cdb00 1133385989 C Bi:1:012:1 0 4096 = 00000000 00000000 00000000 00000000 00000000 00000000 00000000 00000000
e46cdc80 1133385994 C Bi:1:012:1 0 4096 = 00000000 00000000 00000000 00000000 00000000 00000000 00000000 00000000
e46cd500 1133385999 C Bi:1:012:1 0 4096 = 00000000 00000000 00000000 00000000 00000000 00000000 00000000 00000000
e46cd780 1133386004 C Bi:1:012:1 0 4096 = 00000000 00000000 00000000 00000000 00000000 00000000 00000000 00000000
e46cd180 1133386008 C Bi:1:012:1 0 4096 = 00000000 00000000 00000000 00000000 00000000 00000000 00000000 00000000
f6130e80 1133386745 S Bi:1:012:1 -115 13 <
f6130e80 1133386841 C Bi:1:012:1 0 13 = 55534253 32000000 00000000 00
f6130e80 1133387307 S Bo:1:012:1 -115 31 = 55534243 33000000 00100000 80000a28 00003a9c f9000008 00000000 000000
f6130e80 1133387465 C Bo:1:012:1 0 31 >
ee2c4b00 1133387497 S Bi:1:012:1 -115 4096 <
ee2c4b00 1133389216 C Bi:1:012:1 0 4096 = ffffffff ffffffff ffffffff ffffffff ffffffff ffffffff ffffffff ffffffff
f6130e80 1133389346 S Bi:1:012:1 -115 13 <
f6130e80 1133389464 C Bi:1:012:1 0 13 = 55534253 33000000 00000000 00
f6130e80 1133393421 S Bo:1:012:1 -115 31 = 55534243 34000000 00100000 80000a28 00003a9d c1000008 00000000 000000
f6130e80 1133393465 C Bo:1:012:1 0 31 >
e46cd700 1133393517 S Bi:1:012:1 -115 4096 <
e46cd700 1133394973 C Bi:1:012:1 0 4096 = ffffffff ffffffff ffffffff ffffffff ffffffff ffffffff ffffffff ffffffff
f6130e80 1133395029 S Bi:1:012:1 -115 13 <
f6130e80 1133395097 C Bi:1:012:1 0 13 = 55534253 34000000 00000000 00
f6130e80 1133395261 S Bo:1:012:1 -115 31 = 55534243 35000000 00100000 80000a28 00003a9d 01000008 00000000 000000
f6130e80 1133395347 C Bo:1:012:1 0 31 >
e46cd700 1133395388 S Bi:1:012:1 -115 4096 <
e46cd700 1133396849 C Bi:1:012:1 0 4096 = ffffffff ffffffff ffffffff ffffffff ffffffff ffffffff ffffffff ffffffff
f6130e80 1133396909 S Bi:1:012:1 -115 13 <
f6130e80 1133396972 C Bi:1:012:1 0 13 = 55534253 35000000 00000000 00
f6130e80 1133398467 S Bo:1:012:1 -115 31 = 55534243 36000000 00100000 80000a28 00003a9c 71000008 00000000 000000
f6130e80 1133398590 C Bo:1:012:1 0 31 >
ee2c4880 1133398620 S Bi:1:012:1 -115 4096 <
ee2c4880 1133399841 C Bi:1:012:1 0 4096 = ffffffff ffffffff ffffffff ffffffff ffffffff ffffffff ffffffff ffffffff
f6130e80 1133399872 S Bi:1:012:1 -115 13 <
f6130e80 1133399965 C Bi:1:012:1 0 13 = 55534253 36000000 00000000 00
f6130e80 1133400098 S Bo:1:012:1 -115 31 = 55534243 37000000 000e0000 80000a28 00003a9d f1000007 00000000 000000
f6130e80 1133400214 C Bo:1:012:1 0 31 >
ee2c4100 1133400245 S Bi:1:012:1 -115 3584 <
ee2c4100 1133401724 C Bi:1:012:1 0 3584 = ffffffff ffffffff ffffffff ffffffff ffffffff ffffffff ffffffff ffffffff
f6130e80 1133405583 S Bi:1:012:1 -115 13 <
f6130e80 1133405719 C Bi:1:012:1 0 13 = 55534253 37000000 00000000 00
f6130e80 1133405796 S Bo:1:012:1 -115 31 = 55534243 38000000 00020000 80000a28 00003a9d f8000001 00000000 000000
f6130e80 1133405963 C Bo:1:012:1 0 31 >
ee2c4580 1133405994 S Bi:1:012:1 -115 512 <
ee2c4580 1133406590 C Bi:1:012:1 0 512 = ffffffff ffffffff ffffffff ffffffff ffffffff ffffffff ffffffff ffffffff
f6130e80 1133406621 S Bi:1:012:1 -115 13 <
f6130e80 1133406715 C Bi:1:012:1 0 13 = 55534253 38000000 00000000 00
f6130e80 1133406956 S Bo:1:012:1 -115 31 = 55534243 39000000 00200000 80000a28 0000001d e9000010 00000000 000000
f6130e80 1133407090 C Bo:1:012:1 0 31 >
ee2c4180 1133407121 S Bi:1:012:1 -115 4096 <
ee2c4f00 1133407127 S Bi:1:012:1 -115 4096 <
ee2c4180 1133409593 C Bi:1:012:1 0 4096 = 00000000 00000000 00000000 00000000 00000000 00000000 00000000 00000000
ee2c4f00 1133409602 C Bi:1:012:1 0 4096 = e5465842 4f4f5420 43464720 00646891 8d3ada3a 05006891 8d3ac84b 96010000
f6130e80 1133409630 S Bi:1:012:1 -115 13 <
f6130e80 1133409715 C Bi:1:012:1 0 13 = 55534253 39000000 00000000 00
f6130e80 1133410286 S Bo:1:012:1 -115 31 = 55534243 3a000000 00200000 80000a28 00002a7c c9000010 00000000 000000
f6130e80 1133410340 C Bo:1:012:1 0 31 >
d6460180 1133410627 S Bi:1:012:1 -115 4096 <
d6460700 1133410638 S Bi:1:012:1 -115 4096 <
d6460180 1133413217 C Bi:1:012:1 0 4096 = 62a82d9f 87e72804 8d0602c4 70b0506c 14118504 a120a048 2a121099 5254a7b7
d6460700 1133413226 C Bi:1:012:1 0 4096 = e5343036 5f307e33 4a504720 0000c938 913ad63a 0000c938 913a0f04 7c720200
f6130e80 1133413255 S Bi:1:012:1 -115 13 <
f6130e80 1133413339 C Bi:1:012:1 0 13 = 55534253 3a000000 00000000 00
f6130e80 1133413513 S Bo:1:012:1 -115 31 = 55534243 3b000000 00000100 80000a28 00000000 e9000080 00000000 000000
f6130e80 1133413589 C Bo:1:012:1 0 31 >
d6460800 1133413627 S Bi:1:012:1 -115 4096 <
d6460000 1133413634 S Bi:1:012:1 -115 4096 <
d6460080 1133413639 S Bi:1:012:1 -115 4096 <
d6460200 1133413643 S Bi:1:012:1 -115 4096 <
d6460b80 1133413648 S Bi:1:012:1 -115 4096 <
d6460a00 1133413652 S Bi:1:012:1 -115 4096 <
d6460980 1133413657 S Bi:1:012:1 -115 4096 <
d6460100 1133413662 S Bi:1:012:1 -115 4096 <
d6460380 1133413666 S Bi:1:012:1 -115 4096 <
f6130880 1133413671 S Bi:1:012:1 -115 4096 <
f6130c00 1133413675 S Bi:1:012:1 -115 4096 <
f6130b00 1133413680 S Bi:1:012:1 -115 4096 <
f6130800 1133413684 S Bi:1:012:1 -115 4096 <
f6130280 1133413689 S Bi:1:012:1 -115 4096 <
f6130200 1133413693 S Bi:1:012:1 -115 4096 <
f6130180 1133413698 S Bi:1:012:1 -115 4096 <
d6460800 1133425407 C Bi:1:012:1 0 4096 = 00000000 00000000 00000000 00000000 00000000 00000000 00000000 00000000
d6460000 1133425421 C Bi:1:012:1 0 4096 = 00000000 00000000 00000000 00000000 00000000 00000000 00000000 00000000
d6460080 1133425426 C Bi:1:012:1 0 4096 = 00000000 00000000 00000000 00000000 00000000 00000000 00000000 00000000
d6460200 1133425431 C Bi:1:012:1 0 4096 = 00000000 00000000 00000000 00000000 00000000 00000000 00000000 00000000
d6460b80 1133429095 C Bi:1:012:1 0 4096 = 00000000 00000000 00000000 00000000 00000000 00000000 00000000 00000000
d6460a00 1133429108 C Bi:1:012:1 0 4096 = 00000000 00000000 00000000 00000000 00000000 00000000 00000000 00000000
d6460980 1133429113 C Bi:1:012:1 0 4096 = 00000000 00000000 00000000 00000000 00000000 00000000 00000000 00000000
d6460100 1133429117 C Bi:1:012:1 0 4096 = 00000000 00000000 00000000 00000000 00000000 00000000 00000000 00000000
d6460380 1133429122 C Bi:1:012:1 0 4096 = 00000000 00000000 00000000 00000000 00000000 00000000 00000000 00000000
f6130880 1133429127 C Bi:1:012:1 0 4096 = 00000000 00000000 00000000 00000000 00000000 00000000 00000000 00000000
f6130c00 1133429131 C Bi:1:012:1 0 4096 = 00000000 00000000 00000000 00000000 00000000 00000000 00000000 00000000
f6130b00 1133429136 C Bi:1:012:1 0 4096 = 00000000 00000000 00000000 00000000 00000000 00000000 00000000 00000000
f6130800 1133429141 C Bi:1:012:1 0 4096 = 00000000 00000000 00000000 00000000 00000000 00000000 00000000 00000000
f6130280 1133429146 C Bi:1:012:1 0 4096 = 00000000 00000000 00000000 00000000 00000000 00000000 00000000 00000000
f6130200 1133429150 C Bi:1:012:1 0 4096 = 00000000 00000000 00000000 00000000 00000000 00000000 00000000 00000000
f6130180 1133429155 C Bi:1:012:1 0 4096 = 00000000 00000000 00000000 00000000 00000000 00000000 00000000 00000000
f6130e80 1133433436 S Bi:1:012:1 -115 13 <
f6130e80 1133433592 C Bi:1:012:1 0 13 = 55534253 3b000000 00000000 00
f6130e80 1133439271 S Bo:1:012:1 -115 31 = 55534243 3c000000 00200000 80000a28 0000000b 39000010 00000000 000000
f6130e80 1133439344 C Bo:1:012:1 0 31 >
e46cd400 1133439397 S Bi:1:012:1 -115 4096 <
e46cd700 1133439404 S Bi:1:012:1 -115 4096 <
e46cd400 1133441841 C Bi:1:012:1 0 4096 = 00000000 00000000 00000000 00000000 00000000 00000000 00000000 00000000
e46cd700 1133441851 C Bi:1:012:1 0 4096 = 00000000 00000000 00000000 00000000 00000000 00000000 00000000 00000000
f6130e80 1133442261 S Bi:1:012:1 -115 13 <
f6130e80 1133442348 C Bi:1:012:1 0 13 = 55534253 3c000000 00000000 00
f6130e80 1133481642 S Bo:1:012:1 -115 31 = 55534243 3d000000 00200000 80000a28 00000051 99000010 00000000 000000
f6130e80 1133481718 C Bo:1:012:1 0 31 >
e46cd400 1133481801 S Bi:1:012:1 -115 4096 <
e46cd700 1133481809 S Bi:1:012:1 -115 4096 <
e46cd400 1133485476 C Bi:1:012:1 0 4096 = cba2eb91 c398f043 80303fce 2bcebc39 a84af7b3 4b23b6d8 81246400 4f18c923
e46cd700 1133485485 C Bi:1:012:1 0 4096 = e5353234 5f317e36 4a504720 00000b35 ba3ad63a 00000b35 ba3a010c 76440300
f6130e80 1133485580 S Bi:1:012:1 -115 13 <
f6130e80 1133485722 C Bi:1:012:1 0 13 = 55534253 3d000000 00000000 00
f6130e80 1133486007 S Bo:1:012:1 -115 31 = 55534243 3e000000 00200000 80000a28 0000008f f1000010 00000000 000000
f6130e80 1133486097 C Bo:1:012:1 0 31 >
e46cd400 1133486176 S Bi:1:012:1 -115 4096 <
e46cd700 1133486183 S Bi:1:012:1 -115 4096 <
e46cd400 1133488591 C Bi:1:012:1 0 4096 = cbae85c9 a4c8a552 1941e9dc fb51232e c0ff00dd c8fd6b18 277d06a3 75a1343d
e46cd700 1133488602 C Bi:1:012:1 0 4096 = 00000000 00000000 00000000 00000000 00000000 00000000 00000000 00000000
f6130e80 1133488805 S Bi:1:012:1 -115 13 <
f6130e80 1133488975 C Bi:1:012:1 0 13 = 55534253 3e000000 00000000 00
f6130e80 1133490543 S Bo:1:012:1 -115 31 = 55534243 3f000000 00000100 80000a28 00000001 69000080 00000000 000000
f6130e80 1133490589 C Bo:1:012:1 0 31 >
e46cd400 1133490633 S Bi:1:012:1 -115 4096 <
e46cd700 1133490640 S Bi:1:012:1 -115 4096 <
e46cd980 1133490645 S Bi:1:012:1 -115 4096 <
e46cdd80 1133490650 S Bi:1:012:1 -115 4096 <
e46cdc00 1133490654 S Bi:1:012:1 -115 4096 <
e46cd800 1133490659 S Bi:1:012:1 -115 4096 <
e46cd300 1133490663 S Bi:1:012:1 -115 4096 <
e46cdf00 1133490668 S Bi:1:012:1 -115 4096 <
e46cd600 1133490673 S Bi:1:012:1 -115 4096 <
e46cd480 1133490677 S Bi:1:012:1 -115 4096 <
e46cd680 1133490682 S Bi:1:012:1 -115 4096 <
e46cd280 1133490687 S Bi:1:012:1 -115 4096 <
e46cd580 1133490691 S Bi:1:012:1 -115 4096 <
e46cd100 1133490696 S Bi:1:012:1 -115 4096 <
e46cdf80 1133490700 S Bi:1:012:1 -115 4096 <
e46cdd00 1133490704 S Bi:1:012:1 -115 4096 <
e46cd400 1133501403 C Bi:1:012:1 0 4096 = 00000000 00000000 00000000 00000000 00000000 00000000 00000000 00000000
e46cd700 1133501414 C Bi:1:012:1 0 4096 = 00000000 00000000 00000000 00000000 00000000 00000000 00000000 00000000
e46cd980 1133501419 C Bi:1:012:1 0 4096 = 00000000 00000000 00000000 00000000 00000000 00000000 00000000 00000000
e46cdd80 1133501424 C Bi:1:012:1 0 4096 = 00000000 00000000 00000000 00000000 00000000 00000000 00000000 00000000
e46cdc00 1133501429 C Bi:1:012:1 0 4096 = 00000000 00000000 00000000 00000000 00000000 00000000 00000000 00000000
e46cd800 1133501433 C Bi:1:012:1 0 4096 = 00000000 00000000 00000000 00000000 00000000 00000000 00000000 00000000
e46cd300 1133504350 C Bi:1:012:1 0 4096 = 00000000 00000000 00000000 00000000 00000000 00000000 00000000 00000000
e46cdf00 1133504358 C Bi:1:012:1 0 4096 = 00000000 00000000 00000000 00000000 00000000 00000000 00000000 00000000
e46cd600 1133504363 C Bi:1:012:1 0 4096 = 00000000 00000000 00000000 00000000 00000000 00000000 00000000 00000000
e46cd480 1133504367 C Bi:1:012:1 0 4096 = 00000000 00000000 00000000 00000000 00000000 00000000 00000000 00000000
e46cd680 1133504372 C Bi:1:012:1 0 4096 = 00000000 00000000 00000000 00000000 00000000 00000000 00000000 00000000
e46cd280 1133504376 C Bi:1:012:1 0 4096 = 00000000 00000000 00000000 00000000 00000000 00000000 00000000 00000000
e46cd580 1133504380 C Bi:1:012:1 0 4096 = 00000000 00000000 00000000 00000000 00000000 00000000 00000000 00000000
e46cd100 1133504385 C Bi:1:012:1 0 4096 = 00000000 00000000 00000000 00000000 00000000 00000000 00000000 00000000
e46cdf80 1133504389 C Bi:1:012:1 0 4096 = 00000000 00000000 00000000 00000000 00000000 00000000 00000000 00000000
e46cdd00 1133504394 C Bi:1:012:1 0 4096 = 00000000 00000000 00000000 00000000 00000000 00000000 00000000 00000000
f6130e80 1133504626 S Bi:1:012:1 -115 13 <
f6130e80 1133504721 C Bi:1:012:1 0 13 = 55534253 3f000000 00000000 00
f6130e80 1133504970 S Bo:1:012:1 -115 31 = 55534243 40000000 00000100 80000a28 00000001 e9000080 00000000 000000
f6130e80 1133505098 C Bo:1:012:1 0 31 >
e46cd700 1133505145 S Bi:1:012:1 -115 4096 <
e46cd980 1133505152 S Bi:1:012:1 -115 4096 <
e46cdd80 1133505156 S Bi:1:012:1 -115 4096 <
e46cdc00 1133505161 S Bi:1:012:1 -115 4096 <
e46cd800 1133505165 S Bi:1:012:1 -115 4096 <
e46cd300 1133505170 S Bi:1:012:1 -115 4096 <
e46cdf00 1133505174 S Bi:1:012:1 -115 4096 <
e46cd600 1133505178 S Bi:1:012:1 -115 4096 <
e46cd480 1133505183 S Bi:1:012:1 -115 4096 <
e46cd680 1133505187 S Bi:1:012:1 -115 4096 <
e46cd280 1133505192 S Bi:1:012:1 -115 4096 <
e46cd580 1133505196 S Bi:1:012:1 -115 4096 <
e46cd100 1133505201 S Bi:1:012:1 -115 4096 <
e46cdf80 1133505205 S Bi:1:012:1 -115 4096 <
e46cdd00 1133505209 S Bi:1:012:1 -115 4096 <
e46cdb80 1133505214 S Bi:1:012:1 -115 4096 <
e46cd700 1133513106 C Bi:1:012:1 0 4096 = 00000000 00000000 00000000 00000000 00000000 00000000 00000000 00000000
e46cd980 1133513116 C Bi:1:012:1 0 4096 = 00000000 00000000 00000000 00000000 00000000 00000000 00000000 00000000
e46cdd80 1133513121 C Bi:1:012:1 0 4096 = 00000000 00000000 00000000 00000000 00000000 00000000 00000000 00000000
e46cdc00 1133513126 C Bi:1:012:1 0 4096 = 00000000 00000000 00000000 00000000 00000000 00000000 00000000 00000000
e46cd800 1133513130 C Bi:1:012:1 0 4096 = 00000000 00000000 00000000 00000000 00000000 00000000 00000000 00000000
e46cd300 1133513135 C Bi:1:012:1 0 4096 = 00000000 00000000 00000000 00000000 00000000 00000000 00000000 00000000
e46cdf00 1133513140 C Bi:1:012:1 0 4096 = 00000000 00000000 00000000 00000000 00000000 00000000 00000000 00000000
e46cd600 1133513144 C Bi:1:012:1 0 4096 = 00000000 00000000 00000000 00000000 00000000 00000000 00000000 00000000
e46cd480 1133513149 C Bi:1:012:1 0 4096 = 00000000 00000000 00000000 00000000 00000000 00000000 00000000 00000000
e46cd680 1133513153 C Bi:1:012:1 0 4096 = 00000000 00000000 00000000 00000000 00000000 00000000 00000000 00000000
e46cd280 1133513158 C Bi:1:012:1 0 4096 = 00000000 00000000 00000000 00000000 00000000 00000000 00000000 00000000
e46cd580 1133513163 C Bi:1:012:1 0 4096 = 00000000 00000000 00000000 00000000 00000000 00000000 00000000 00000000
e46cd100 1133513167 C Bi:1:012:1 0 4096 = 00000000 00000000 00000000 00000000 00000000 00000000 00000000 00000000
e46cdf80 1133513172 C Bi:1:012:1 0 4096 = 00000000 00000000 00000000 00000000 00000000 00000000 00000000 00000000
e46cdd00 1133513177 C Bi:1:012:1 0 4096 = 00000000 00000000 00000000 00000000 00000000 00000000 00000000 00000000
e46cdb80 1133513181 C Bi:1:012:1 0 4096 = 00000000 00000000 00000000 00000000 00000000 00000000 00000000 00000000
f6130e80 1133513605 S Bi:1:012:1 -115 13 <
f6130e80 1133513724 C Bi:1:012:1 0 13 = 55534253 40000000 00000000 00
f6130e80 1133513963 S Bo:1:012:1 -115 31 = 55534243 41000000 00100000 80000a28 00000002 89000008 00000000 000000
f6130e80 1133514100 C Bo:1:012:1 0 31 >
e46cd700 1133514141 S Bi:1:012:1 -115 4096 <
e46cd700 1133517848 C Bi:1:012:1 0 4096 = 00000000 00000000 00000000 00000000 00000000 00000000 00000000 00000000
f6130e80 1133517900 S Bi:1:012:1 -115 13 <
f6130e80 1133517971 C Bi:1:012:1 0 13 = 55534253 41000000 00000000 00
f6130e80 1133519485 S Bo:1:012:1 -115 31 = 55534243 42000000 00000000 0000061e 00000000 00000000 00000000 000000
f6130e80 1133519597 C Bo:1:012:1 0 31 >
f6130e80 1133519635 S Bi:1:012:1 -115 13 <
f6130e80 1133519722 C Bi:1:012:1 0 13 = 55534253 42000000 00000000 00
f6130e80 1133534316 S Bo:1:012:1 -115 31 = 55534243 43000000 00000000 00000600 00000000 00000000 00000000 000000
f6130e80 1133534468 C Bo:1:012:1 0 31 >
f6130e80 1133534518 S Bi:1:012:1 -115 13 <
f6130e80 1133534713 C Bi:1:012:1 0 13 = 55534253 43000000 00000000 00
f6130e80 1133534819 S Bo:1:012:1 -115 31 = 55534243 44000000 00000000 0000061e 00000001 00000000 00000000 000000
f6130e80 1133534964 C Bo:1:012:1 0 31 >
f6130e80 1133535005 S Bi:1:012:1 -115 13 <
f6130e80 1133535088 C Bi:1:012:1 0 13 = 55534253 44000000 00000000 00
f6130e80 1133540239 S Bo:1:012:1 -115 31 = 55534243 45000000 00000000 00000600 00000000 00000000 00000000 000000
f6130e80 1133540348 C Bo:1:012:1 0 31 >
f6130e80 1133540391 S Bi:1:012:1 -115 13 <
f6130e80 1133540599 C Bi:1:012:1 0 13 = 55534253 45000000 00000000 00
f6130e80 1133541942 S Bo:1:012:1 -115 31 = 55534243 46000000 00400000 80000a28 00000000 00000020 00000000 000000
f6130e80 1133542101 C Bo:1:012:1 0 31 >
e46cd800 1133542150 S Bi:1:012:1 -115 4096 <
e46cd300 1133542157 S Bi:1:012:1 -115 4096 <
e46cdf00 1133542162 S Bi:1:012:1 -115 4096 <
e46cd600 1133542167 S Bi:1:012:1 -115 4096 <
e46cd800 1133545968 C Bi:1:012:1 0 4096 = fa31c08e d88ed0bc 007c89e6 0657528e c0fbfcbf 0006b900 01f3a5ea 20060000
e46cd300 1133545981 C Bi:1:012:1 0 4096 = ffffffff ffffffff ffffffff ffffffff ffffffff ffffffff ffffffff ffffffff
e46cdf00 1133545985 C Bi:1:012:1 0 4096 = ffffffff ffffffff ffffffff ffffffff ffffffff ffffffff ffffffff ffffffff
e46cd600 1133545990 C Bi:1:012:1 0 4096 = ffffffff ffffffff ffffffff ffffffff ffffffff ffffffff ffffffff ffffffff
f6130e80 1133564623 S Bi:1:012:1 -115 13 <
f6130e80 1133564716 C Bi:1:012:1 0 13 = 55534253 46000000 00000000 00
f6130e80 1133564867 S Bo:1:012:1 -115 31 = 55534243 47000000 00100000 80000a28 00003a9d 80000008 00000000 000000
f6130e80 1133564962 C Bo:1:012:1 0 31 >
e46cd980 1133564987 S Bi:1:012:1 -115 4096 <
e46cd980 1133566591 C Bi:1:012:1 0 4096 = ffffffff ffffffff ffffffff ffffffff ffffffff ffffffff ffffffff ffffffff
f6130e80 1133566650 S Bi:1:012:1 -115 13 <
f6130e80 1133566712 C Bi:1:012:1 0 13 = 55534253 47000000 00000000 00
f6130e80 1133566819 S Bo:1:012:1 -115 31 = 55534243 48000000 00100000 80000a28 00003a9d f0000008 00000000 000000
f6130e80 1133566963 C Bo:1:012:1 0 31 >
e46cd980 1133566986 S Bi:1:012:1 -115 4096 <
e46cd980 1133568592 C Bi:1:012:1 0 4096 = ffffffff ffffffff ffffffff ffffffff ffffffff ffffffff ffffffff ffffffff
f6130e80 1133570602 S Bi:1:012:1 -115 13 <
f6130e80 1133570714 C Bi:1:012:1 0 13 = 55534253 48000000 00000000 00
f6130e80 1133570860 S Bo:1:012:1 -115 31 = 55534243 49000000 00020000 80000a28 00003a9d f8000001 00000000 000000
f6130e80 1133570962 C Bo:1:012:1 0 31 >
e46cd280 1133570986 S Bi:1:012:1 -115 512 <
e46cd280 1133571596 C Bi:1:012:1 0 512 = ffffffff ffffffff ffffffff ffffffff ffffffff ffffffff ffffffff ffffffff
f6130e80 1133571625 S Bi:1:012:1 -115 13 <
f6130e80 1133571719 C Bi:1:012:1 0 13 = 55534253 49000000 00000000 00
f6130e80 1133571756 S Bo:1:012:1 -115 31 = 55534243 4a000000 00020000 80000a28 00003a9d f9000001 00000000 000000
f6130e80 1133571844 C Bo:1:012:1 0 31 >
e46cd280 1133571864 S Bi:1:012:1 -115 512 <
e46cd280 1133572094 C Bi:1:012:1 0 512 = ffffffff ffffffff ffffffff ffffffff ffffffff ffffffff ffffffff ffffffff
f6130e80 1133572117 S Bi:1:012:1 -115 13 <
f6130e80 1133572219 C Bi:1:012:1 0 13 = 55534253 4a000000 00000000 00
f6130e80 1133572250 S Bo:1:012:1 -115 31 = 55534243 4b000000 00020000 80000a28 00003a9d fa000001 00000000 000000
f6130e80 1133572344 C Bo:1:012:1 0 31 >
e46cd280 1133572364 S Bi:1:012:1 -115 512 <
e46cd280 1133572719 C Bi:1:012:1 0 512 = ffffffff ffffffff ffffffff ffffffff ffffffff ffffffff ffffffff ffffffff
f6130e80 1133572742 S Bi:1:012:1 -115 13 <
f6130e80 1133572844 C Bi:1:012:1 0 13 = 55534253 4b000000 00000000 00
f6130e80 1133572874 S Bo:1:012:1 -115 31 = 55534243 4c000000 00020000 80000a28 00003a9d fb000001 00000000 000000
f6130e80 1133572969 C Bo:1:012:1 0 31 >
e46cd280 1133572988 S Bi:1:012:1 -115 512 <
e46cd280 1133573340 C Bi:1:012:1 0 512 = ffffffff ffffffff ffffffff ffffffff ffffffff ffffffff ffffffff ffffffff
f6130e80 1133573673 S Bi:1:012:1 -115 13 <
f6130e80 1133573721 C Bi:1:012:1 0 13 = 55534253 4c000000 00000000 00
f6130e80 1133573762 S Bo:1:012:1 -115 31 = 55534243 4d000000 00020000 80000a28 00003a9d fc000001 00000000 000000
f6130e80 1133573844 C Bo:1:012:1 0 31 >
e46cd280 1133573864 S Bi:1:012:1 -115 512 <
e46cd280 1133573969 C Bi:1:012:1 0 512 = ffffffff ffffffff ffffffff ffffffff ffffffff ffffffff ffffffff ffffffff
f6130e80 1133573991 S Bi:1:012:1 -115 13 <
f6130e80 1133574095 C Bi:1:012:1 0 13 = 55534253 4d000000 00000000 00
f6130e80 1133574125 S Bo:1:012:1 -115 31 = 55534243 4e000000 00020000 80000a28 00003a9d fd000001 00000000 000000
f6130e80 1133574219 C Bo:1:012:1 0 31 >
e46cd280 1133574239 S Bi:1:012:1 -115 512 <
e46cd280 1133574593 C Bi:1:012:1 0 512 = ffffffff ffffffff ffffffff ffffffff ffffffff ffffffff ffffffff ffffffff
f6130e80 1133574616 S Bi:1:012:1 -115 13 <
f6130e80 1133574719 C Bi:1:012:1 0 13 = 55534253 4e000000 00000000 00
f6130e80 1133574749 S Bo:1:012:1 -115 31 = 55534243 4f000000 00020000 80000a28 00003a9d fe000001 00000000 000000
f6130e80 1133574844 C Bo:1:012:1 0 31 >
e46cd280 1133574862 S Bi:1:012:1 -115 512 <
e46cd280 1133575218 C Bi:1:012:1 0 512 = ffffffff ffffffff ffffffff ffffffff ffffffff ffffffff ffffffff ffffffff
f6130e80 1133575241 S Bi:1:012:1 -115 13 <
f6130e80 1133575344 C Bi:1:012:1 0 13 = 55534253 4f000000 00000000 00
f6130e80 1133575405 S Bo:1:012:1 -115 31 = 55534243 50000000 00020000 80000a28 00003a9d ff000001 00000000 000000
f6130e80 1133575462 C Bo:1:012:1 0 31 >
e46cd280 1133575485 S Bi:1:012:1 -115 512 <
e46cd280 1133575838 C Bi:1:012:1 0 512 = ffffffff ffffffff ffffffff ffffffff ffffffff ffffffff ffffffff ffffffff
f6130e80 1133576022 S Bi:1:012:1 -115 13 <
f6130e80 1133576095 C Bi:1:012:1 0 13 = 55534253 50000000 00000000 00
f6130e80 1133576202 S Bo:1:012:1 -115 31 = 55534243 51000000 00800000 80000a28 00000000 20000040 00000000 000000
f6130e80 1133576345 C Bo:1:012:1 0 31 >
e46cd280 1133576368 S Bi:1:012:1 -115 4096 <
e46cd580 1133576372 S Bi:1:012:1 -115 4096 <
e46cd100 1133576375 S Bi:1:012:1 -115 4096 <
e46cdf80 1133576378 S Bi:1:012:1 -115 4096 <
e46cdd00 1133576381 S Bi:1:012:1 -115 4096 <
e46cdb80 1133576384 S Bi:1:012:1 -115 4096 <
e46cd000 1133576387 S Bi:1:012:1 -115 4096 <
e46cdb00 1133576390 S Bi:1:012:1 -115 4096 <
e46cd280 1133583221 C Bi:1:012:1 0 4096 = ffffffff ffffffff ffffffff ffffffff ffffffff ffffffff ffffffff ffffffff
e46cd580 1133583229 C Bi:1:012:1 0 4096 = ffffffff ffffffff ffffffff ffffffff ffffffff ffffffff ffffffff ffffffff
e46cd100 1133583232 C Bi:1:012:1 0 4096 = ffffffff ffffffff ffffffff ffffffff ffffffff ffffffff ffffffff ffffffff
e46cdf80 1133583234 C Bi:1:012:1 0 4096 = ffffffff ffffffff ffffffff ffffffff ffffffff ffffffff ffffffff ffffffff
e46cdd00 1133583237 C Bi:1:012:1 0 4096 = ffffffff ffffffff ffffffff ffffffff ffffffff ffffffff ffffffff ffffffff
e46cdb80 1133583240 C Bi:1:012:1 0 4096 = ffffffff ffffffff ffffffff ffffffff ffffffff ffffffff ffffffff ffffffff
e46cd000 1133583243 C Bi:1:012:1 0 4096 = ffffffff ffffffff ffffffff ffffffff ffffffff ffffffff ffffffff ffffffff
e46cdb00 1133583246 C Bi:1:012:1 0 4096 = ffffffff ffffffff ffffffff ffffffff ffffffff ffffffff ffffffff ffffffff
f6130e80 1133583443 S Bi:1:012:1 -115 13 <
f6130e80 1133583587 C Bi:1:012:1 0 13 = 55534253 51000000 00000000 00
f6130e80 1133588667 S Bo:1:012:1 -115 31 = 55534243 52000000 00100000 80000a28 00003a9c f8000008 00000000 000000
f6130e80 1133588715 C Bo:1:012:1 0 31 >
e46cd680 1133588745 S Bi:1:012:1 -115 4096 <
e46cd680 1133590090 C Bi:1:012:1 0 4096 = ffffffff ffffffff ffffffff ffffffff ffffffff ffffffff ffffffff ffffffff
f6130e80 1133590149 S Bi:1:012:1 -115 13 <
f6130e80 1133590212 C Bi:1:012:1 0 13 = 55534253 52000000 00000000 00
f6130e80 1133590319 S Bo:1:012:1 -115 31 = 55534243 53000000 00100000 80000a28 00003a9d c0000008 00000000 000000
f6130e80 1133590463 C Bo:1:012:1 0 31 >
e46cd680 1133590487 S Bi:1:012:1 -115 4096 <
e46cd680 1133592091 C Bi:1:012:1 0 4096 = ffffffff ffffffff ffffffff ffffffff ffffffff ffffffff ffffffff ffffffff
f6130e80 1133592147 S Bi:1:012:1 -115 13 <
f6130e80 1133592212 C Bi:1:012:1 0 13 = 55534253 53000000 00000000 00
f6130e80 1133592342 S Bo:1:012:1 -115 31 = 55534243 54000000 00100000 80000a28 00003a9d 00000008 00000000 000000
f6130e80 1133592463 C Bo:1:012:1 0 31 >
e46cd680 1133592486 S Bi:1:012:1 -115 4096 <
e46cd680 1133594091 C Bi:1:012:1 0 4096 = ffffffff ffffffff ffffffff ffffffff ffffffff ffffffff ffffffff ffffffff
f6130e80 1133610415 S Bi:1:012:1 -115 13 <
f6130e80 1133610591 C Bi:1:012:1 0 13 = 55534253 54000000 00000000 00
f6130e80 1133618299 S Bo:1:012:1 -115 31 = 55534243 55000000 00100000 80000a28 00003a9c 70000008 00000000 000000
f6130e80 1133618465 C Bo:1:012:1 0 31 >
f0357700 1133618492 S Bi:1:012:1 -115 4096 <
f0357700 1133619838 C Bi:1:012:1 0 4096 = ffffffff ffffffff ffffffff ffffffff ffffffff ffffffff ffffffff ffffffff
f6130e80 1133620061 S Bi:1:012:1 -115 13 <
f6130e80 1133620213 C Bi:1:012:1 0 13 = 55534253 55000000 00000000 00
f6130e80 1133626665 S Bo:1:012:1 -115 31 = 55534243 56000000 00e00100 80000a28 00000000 600000f0 00000000 000000
f6130e80 1133626723 C Bo:1:012:1 0 31 >
f0357a80 1133626829 S Bi:1:012:1 -115 4096 <
f0357100 1133626837 S Bi:1:012:1 -115 4096 <
f0357400 1133626840 S Bi:1:012:1 -115 4096 <
f0357680 1133626844 S Bi:1:012:1 -115 4096 <
f0357200 1133626846 S Bi:1:012:1 -115 4096 <
f0357500 1133626848 S Bi:1:012:1 -115 4096 <
f0357900 1133626851 S Bi:1:012:1 -115 4096 <
f0357080 1133626854 S Bi:1:012:1 -115 4096 <
f0357800 1133626857 S Bi:1:012:1 -115 4096 <
f0357d80 1133626860 S Bi:1:012:1 -115 4096 <
f0357e00 1133626862 S Bi:1:012:1 -115 4096 <
f0357780 1133626864 S Bi:1:012:1 -115 4096 <
f0357b00 1133626868 S Bi:1:012:1 -115 4096 <
f0357c80 1133626870 S Bi:1:012:1 -115 4096 <
f022ee00 1133626873 S Bi:1:012:1 -115 4096 <
f022e580 1133626875 S Bi:1:012:1 -115 4096 <
f022e300 1133626877 S Bi:1:012:1 -115 4096 <
f022e200 1133626881 S Bi:1:012:1 -115 4096 <
f022ec00 1133626883 S Bi:1:012:1 -115 4096 <
f022e000 1133626885 S Bi:1:012:1 -115 4096 <
f022eb00 1133626888 S Bi:1:012:1 -115 4096 <
f022e080 1133626890 S Bi:1:012:1 -115 4096 <
f022e180 1133626892 S Bi:1:012:1 -115 4096 <
f022e700 1133626895 S Bi:1:012:1 -115 4096 <
f022ed00 1133626897 S Bi:1:012:1 -115 4096 <
f022ef00 1133626900 S Bi:1:012:1 -115 4096 <
f022e380 1133626902 S Bi:1:012:1 -115 4096 <
f022e100 1133626904 S Bi:1:012:1 -115 4096 <
f022e900 1133626907 S Bi:1:012:1 -115 4096 <
f022e800 1133626909 S Bi:1:012:1 -115 4096 <
f0357a80 1133651969 C Bi:1:012:1 0 4096 = ffffffff ffffffff ffffffff ffffffff ffffffff ffffffff ffffffff ffffffff
f0357100 1133651979 C Bi:1:012:1 0 4096 = ffffffff ffffffff ffffffff ffffffff ffffffff ffffffff ffffffff ffffffff
f0357400 1133651982 C Bi:1:012:1 0 4096 = ffffffff ffffffff ffffffff ffffffff ffffffff ffffffff ffffffff ffffffff
f0357680 1133651985 C Bi:1:012:1 0 4096 = ffffffff ffffffff ffffffff ffffffff ffffffff ffffffff ffffffff ffffffff
f0357200 1133651988 C Bi:1:012:1 0 4096 = ffffffff ffffffff ffffffff ffffffff ffffffff ffffffff ffffffff ffffffff
f0357500 1133651991 C Bi:1:012:1 0 4096 = ffffffff ffffffff ffffffff ffffffff ffffffff ffffffff ffffffff ffffffff
f0357900 1133651994 C Bi:1:012:1 0 4096 = 00000000 00000000 00000000 00000000 00000000 00000000 00000000 00000000
f0357080 1133651998 C Bi:1:012:1 0 4096 = 00000000 00000000 00000000 00000000 00000000 00000000 00000000 00000000
f0357800 1133652001 C Bi:1:012:1 0 4096 = 00000000 00000000 00000000 00000000 00000000 00000000 00000000 00000000
f0357d80 1133652004 C Bi:1:012:1 0 4096 = 00000000 00000000 00000000 00000000 00000000 00000000 00000000 00000000
f0357e00 1133652007 C Bi:1:012:1 0 4096 = 00000000 00000000 00000000 00000000 00000000 00000000 00000000 00000000
f0357780 1133652010 C Bi:1:012:1 0 4096 = 00000000 00000000 00000000 00000000 00000000 00000000 00000000 00000000
f0357b00 1133652013 C Bi:1:012:1 0 4096 = 00000000 00000000 00000000 00000000 00000000 00000000 00000000 00000000
f0357c80 1133652017 C Bi:1:012:1 0 4096 = 00000000 00000000 00000000 00000000 00000000 00000000 00000000 00000000
f022ee00 1133652020 C Bi:1:012:1 0 4096 = 00000000 00000000 00000000 00000000 00000000 00000000 00000000 00000000
f022e580 1133652023 C Bi:1:012:1 0 4096 = 00000000 00000000 00000000 00000000 00000000 00000000 00000000 00000000
f022e300 1133652026 C Bi:1:012:1 0 4096 = 00000000 00000000 00000000 00000000 00000000 00000000 00000000 00000000
f022e200 1133652028 C Bi:1:012:1 0 4096 = 00000000 00000000 00000000 00000000 00000000 00000000 00000000 00000000
f022ec00 1133652032 C Bi:1:012:1 0 4096 = 00000000 00000000 00000000 00000000 00000000 00000000 00000000 00000000
f022e000 1133652035 C Bi:1:012:1 0 4096 = 00000000 00000000 00000000 00000000 00000000 00000000 00000000 00000000
f022eb00 1133652038 C Bi:1:012:1 0 4096 = 00000000 00000000 00000000 00000000 00000000 00000000 00000000 00000000
f022e080 1133652041 C Bi:1:012:1 0 4096 = 00000000 00000000 00000000 00000000 00000000 00000000 00000000 00000000
f022e180 1133652044 C Bi:1:012:1 0 4096 = 00000000 00000000 00000000 00000000 00000000 00000000 00000000 00000000
f022e700 1133652047 C Bi:1:012:1 0 4096 = 00000000 00000000 00000000 00000000 00000000 00000000 00000000 00000000
f022ed00 1133652050 C Bi:1:012:1 0 4096 = 00000000 00000000 00000000 00000000 00000000 00000000 00000000 00000000
f022ef00 1133652053 C Bi:1:012:1 0 4096 = 00000000 00000000 00000000 00000000 00000000 00000000 00000000 00000000
f022e380 1133652061 C Bi:1:012:1 0 4096 = 00000000 00000000 00000000 00000000 00000000 00000000 00000000 00000000
f022e100 1133652064 C Bi:1:012:1 0 4096 = 00000000 00000000 00000000 00000000 00000000 00000000 00000000 00000000
f022e900 1133652067 C Bi:1:012:1 0 4096 = 00000000 00000000 00000000 00000000 00000000 00000000 00000000 00000000
f022e800 1133652070 C Bi:1:012:1 0 4096 = 00000000 00000000 00000000 00000000 00000000 00000000 00000000 00000000
f6130e80 1133652593 S Bi:1:012:1 -115 13 <
f6130e80 1133652713 C Bi:1:012:1 0 13 = 55534253 56000000 00000000 00
f6130e80 1133652804 S Bo:1:012:1 -115 31 = 55534243 57000000 00200100 80000a28 00000001 50000090 00000000 000000
f6130e80 1133652837 C Bo:1:012:1 0 31 >
f022ee00 1133652863 S Bi:1:012:1 -115 4096 <
f022e580 1133652870 S Bi:1:012:1 -115 4096 <
f022e300 1133652873 S Bi:1:012:1 -115 4096 <
f022e200 1133652876 S Bi:1:012:1 -115 4096 <
f022ec00 1133652878 S Bi:1:012:1 -115 4096 <
f022e000 1133652881 S Bi:1:012:1 -115 4096 <
f022eb00 1133652883 S Bi:1:012:1 -115 4096 <
f022e080 1133652885 S Bi:1:012:1 -115 4096 <
f022e180 1133652887 S Bi:1:012:1 -115 4096 <
f022e700 1133652891 S Bi:1:012:1 -115 4096 <
f022ed00 1133652893 S Bi:1:012:1 -115 4096 <
f022ef00 1133652896 S Bi:1:012:1 -115 4096 <
f022e380 1133652898 S Bi:1:012:1 -115 4096 <
f022e100 1133652900 S Bi:1:012:1 -115 4096 <
f022e900 1133652902 S Bi:1:012:1 -115 4096 <
f022e800 1133652905 S Bi:1:012:1 -115 4096 <
f022ea00 1133652907 S Bi:1:012:1 -115 4096 <
f024d100 1133652911 S Bi:1:012:1 -115 4096 <
f022ee00 1133661400 C Bi:1:012:1 0 4096 = 00000000 00000000 00000000 00000000 00000000 00000000 00000000 00000000
f022e580 1133661407 C Bi:1:012:1 0 4096 = 00000000 00000000 00000000 00000000 00000000 00000000 00000000 00000000
f022e300 1133661410 C Bi:1:012:1 0 4096 = 00000000 00000000 00000000 00000000 00000000 00000000 00000000 00000000
f022e200 1133661414 C Bi:1:012:1 0 4096 = 00000000 00000000 00000000 00000000 00000000 00000000 00000000 00000000
f022ec00 1133661417 C Bi:1:012:1 0 4096 = 00000000 00000000 00000000 00000000 00000000 00000000 00000000 00000000
f022e000 1133661421 C Bi:1:012:1 0 4096 = 00000000 00000000 00000000 00000000 00000000 00000000 00000000 00000000
f022eb00 1133661424 C Bi:1:012:1 0 4096 = 00000000 00000000 00000000 00000000 00000000 00000000 00000000 00000000
f022e080 1133661427 C Bi:1:012:1 0 4096 = 00000000 00000000 00000000 00000000 00000000 00000000 00000000 00000000
f022e180 1133661430 C Bi:1:012:1 0 4096 = 00000000 00000000 00000000 00000000 00000000 00000000 00000000 00000000
f022e700 1133664349 C Bi:1:012:1 0 4096 = 00000000 00000000 00000000 00000000 00000000 00000000 00000000 00000000
f022ed00 1133664356 C Bi:1:012:1 0 4096 = 00000000 00000000 00000000 00000000 00000000 00000000 00000000 00000000
f022ef00 1133664359 C Bi:1:012:1 0 4096 = 00000000 00000000 00000000 00000000 00000000 00000000 00000000 00000000
f022e380 1133664362 C Bi:1:012:1 0 4096 = 00000000 00000000 00000000 00000000 00000000 00000000 00000000 00000000
f022e100 1133664365 C Bi:1:012:1 0 4096 = 00000000 00000000 00000000 00000000 00000000 00000000 00000000 00000000
f022e900 1133664368 C Bi:1:012:1 0 4096 = 00000000 00000000 00000000 00000000 00000000 00000000 00000000 00000000
f022e800 1133664371 C Bi:1:012:1 0 4096 = 00000000 00000000 00000000 00000000 00000000 00000000 00000000 00000000
f022ea00 1133664374 C Bi:1:012:1 0 4096 = 00000000 00000000 00000000 00000000 00000000 00000000 00000000 00000000
f024d100 1133664376 C Bi:1:012:1 0 4096 = 00000000 00000000 00000000 00000000 00000000 00000000 00000000 00000000
f6130e80 1133664961 S Bi:1:012:1 -115 13 <
f6130e80 1133665088 C Bi:1:012:1 0 13 = 55534253 57000000 00000000 00
f6130e80 1133665158 S Bo:1:012:1 -115 31 = 55534243 58000000 00100000 80000a28 00000002 00000008 00000000 000000
f6130e80 1133665214 C Bo:1:012:1 0 31 >
f024d100 1133665261 S Bi:1:012:1 -115 4096 <
f024d100 1133669475 C Bi:1:012:1 0 4096 = 00000000 00000000 00000000 00000000 00000000 00000000 00000000 00000000
f6130e80 1133670067 S Bi:1:012:1 -115 13 <
f6130e80 1133670217 C Bi:1:012:1 0 13 = 55534253 58000000 00000000 00
f6130e80 1133673408 S Bo:1:012:1 -115 31 = 55534243 59000000 00000000 0000061e 00000000 00000000 00000000 000000
f6130e80 1133673473 C Bo:1:012:1 0 31 >
f6130e80 1133673486 S Bi:1:012:1 -115 13 <
f6130e80 1133673594 C Bi:1:012:1 0 13 = 55534253 59000000 00000000 00
f6130e80 1133698997 S Bo:1:012:1 -115 31 = 55534243 5a000000 00000000 00000600 00000000 00000000 00000000 000000
f6130e80 1133699099 C Bo:1:012:1 0 31 >
f6130e80 1133699130 S Bi:1:012:1 -115 13 <
f6130e80 1133699219 C Bi:1:012:1 0 13 = 55534253 5a000000 00000000 00
f6130e80 1133699264 S Bo:1:012:1 -115 31 = 55534243 5b000000 00000000 0000061e 00000001 00000000 00000000 000000
f6130e80 1133699345 C Bo:1:012:1 0 31 >
f6130e80 1133699363 S Bi:1:012:1 -115 13 <
f6130e80 1133699469 C Bi:1:012:1 0 13 = 55534253 5b000000 00000000 00
f6130e80 1133699558 S Bo:1:012:1 -115 31 = 55534243 5c000000 00020000 80000a28 00000000 89000001 00000000 000000
f6130e80 1133699597 C Bo:1:012:1 0 31 >
f6130300 1133699620 S Bi:1:012:1 -115 512 <
f6130300 1133700226 C Bi:1:012:1 0 512 = eb58906d 6b646f73 66730000 02082000 02000000 00f80000 10000400 10000000
f6130e80 1133700276 S Bi:1:012:1 -115 13 <
f6130e80 1133700351 C Bi:1:012:1 0 13 = 55534253 5c000000 00000000 00
f6130e80 1133700452 S Bo:1:012:1 -115 31 = 55534243 5d000000 00020000 80000a28 00000000 8a000001 00000000 000000
f6130e80 1133700599 C Bo:1:012:1 0 31 >
f6130300 1133700645 S Bi:1:012:1 -115 512 <
f6130300 1133700724 C Bi:1:012:1 0 512 = 52526141 00000000 00000000 00000000 00000000 00000000 00000000 00000000
f6130e80 1133700776 S Bi:1:012:1 -115 13 <
f6130e80 1133700866 C Bi:1:012:1 0 13 = 55534253 5d000000 00000000 00
f6130e80 1133700979 S Bo:1:012:1 -115 31 = 55534243 5e000000 00020000 80000a28 00000000 a9000001 00000000 000000
f6130e80 1133701099 C Bo:1:012:1 0 31 >
f6130300 1133701144 S Bi:1:012:1 -115 512 <
f6130300 1133701607 C Bi:1:012:1 0 512 = f8ffff0f ffffffff de4b0500 ffffff0f ffffff0f ffffff0f 07000000 ffffff0f
f6130e80 1133701663 S Bi:1:012:1 -115 13 <
f6130e80 1133701723 C Bi:1:012:1 0 13 = 55534253 5e000000 00000000 00
f6130e80 1133701825 S Bo:1:012:1 -115 31 = 55534243 5f000000 00020000 80000a28 0000000b 40000001 00000000 000000
f6130e80 1133701974 C Bo:1:012:1 0 31 >
f6130300 1133702009 S Bi:1:012:1 -115 512 <
f6130300 1133707106 C Bi:1:012:1 0 512 = 00000000 00000000 00000000 00000000 00000000 00000000 00000000 00000000
f6130e80 1133707164 S Bi:1:012:1 -115 13 <
f6130e80 1133707223 C Bi:1:012:1 0 13 = 55534253 5f000000 00000000 00
f6130e80 1133707325 S Bo:1:012:1 -115 31 = 55534243 60000000 00020000 80000a28 00000000 b5000001 00000000 000000
f6130e80 1133707473 C Bo:1:012:1 0 31 >
f6130300 1133707508 S Bi:1:012:1 -115 512 <
f6130300 1133708349 C Bi:1:012:1 0 512 = 00000000 00000000 00000000 00000000 00000000 00000000 00000000 00000000
f6130e80 1133708404 S Bi:1:012:1 -115 13 <
f6130e80 1133708473 C Bi:1:012:1 0 13 = 55534253 60000000 00000000 00
f6130e80 1133708572 S Bo:1:012:1 -115 31 = 55534243 61000000 00020000 80000a28 00000000 c5000001 00000000 000000
f6130e80 1133708727 C Bo:1:012:1 0 31 >
f6130300 1133708773 S Bi:1:012:1 -115 512 <
f6130300 1133709223 C Bi:1:012:1 0 512 = 00000000 00000000 00000000 00000000 00000000 00000000 00000000 00000000
f6130e80 1133709277 S Bi:1:012:1 -115 13 <
f6130e80 1133709347 C Bi:1:012:1 0 13 = 55534253 61000000 00000000 00
f6130e80 1133709442 S Bo:1:012:1 -115 31 = 55534243 62000000 00020000 80000a28 0000001d eb000001 00000000 000000
f6130e80 1133709603 C Bo:1:012:1 0 31 >
f6130c80 1133709652 S Bi:1:012:1 -115 512 <
f6130c80 1133710338 C Bi:1:012:1 0 512 = 412e0073 00790073 0074000f 00726500 6d000000 ffffffff ffff0000 ffffffff
f6130e80 1133711176 S Bi:1:012:1 -115 13 <
f6130e80 1133711240 C Bi:1:012:1 0 13 = 55534253 62000000 00000000 00
f6130e80 1133711330 S Bo:1:012:1 -115 31 = 55534243 63000000 000e0000 80000a28 0000001d ec000007 00000000 000000
f6130e80 1133711473 C Bo:1:012:1 0 31 >
f6130980 1133711520 S Bi:1:012:1 -115 2560 <
f6130d80 1133711528 S Bi:1:012:1 -115 1024 <
f6130980 1133713102 C Bi:1:012:1 0 2560 = e5524553 45454420 20202011 00646891 8d3a9a39 05000483 5d39eb49 00000000
f6130d80 1133713110 C Bi:1:012:1 0 1024 = e5465842 4f4f5420 43464720 00646891 8d3ada3a 05006891 8d3ac84b 96010000
f6130e80 1133713230 S Bi:1:012:1 -115 13 <
f6130e80 1133713348 C Bi:1:012:1 0 13 = 55534253 63000000 00000000 00
f6130e80 1133713497 S Bo:1:012:1 -115 31 = 55534243 64000000 00020000 80000a28 00002a7c cb000001 00000000 000000
f6130e80 1133713603 C Bo:1:012:1 0 31 >
f6130c80 1133713654 S Bi:1:012:1 -115 512 <
f6130c80 1133714978 C Bi:1:012:1 0 512 = e5562020 20202020 484c5020 00646891 8d3ada3a 05006891 8d3adf4b c91e0000
f6130e80 1133715032 S Bi:1:012:1 -115 13 <
f6130e80 1133715098 C Bi:1:012:1 0 13 = 55534253 64000000 00000000 00
f6130e80 1133715173 S Bo:1:012:1 -115 31 = 55534243 65000000 000e0000 80000a28 00002a7c cc000007 00000000 000000
f6130e80 1133715213 C Bo:1:012:1 0 31 >
f6130a80 1133715243 S Bi:1:012:1 -115 2560 <
f6130b80 1133715250 S Bi:1:012:1 -115 1024 <
f6130a80 1133716978 C Bi:1:012:1 0 2560 = e54c2020 20202020 54522020 00646891 8d3ada3a 05006891 8d3ae94b cd070000
f6130b80 1133716986 C Bi:1:012:1 0 1024 = e5343036 5f307e33 4a504720 0000c938 913ad63a 0000c938 913a0f04 7c720200
f6130e80 1133717058 S Bi:1:012:1 -115 13 <
f6130e80 1133717223 C Bi:1:012:1 0 13 = 55534253 65000000 00000000 00
f6130e80 1133717372 S Bo:1:012:1 -115 31 = 55534243 66000000 00100000 80000a28 00000051 9b000008 00000000 000000
f6130e80 1133717479 C Bo:1:012:1 0 31 >
f6130b80 1133717532 S Bi:1:012:1 -115 3072 <
f6130c80 1133717540 S Bi:1:012:1 -115 1024 <
f6130b80 1133719478 C Bi:1:012:1 0 3072 = e5300034 00310033 005f000f 005c3000 39003300 33003100 35000000 2e006a00
f6130c80 1133719485 C Bi:1:012:1 0 1024 = e5353234 5f317e36 4a504720 00000b35 ba3ad63a 00000b35 ba3a010c 76440300
f6130e80 1133719569 S Bi:1:012:1 -115 13 <
f6130e80 1133719720 C Bi:1:012:1 0 13 = 55534253 66000000 00000000 00
f6130e80 1133719818 S Bo:1:012:1 -115 31 = 55534243 67000000 00100000 80000a28 0000008f f3000008 00000000 000000
f6130e80 1133719978 C Bo:1:012:1 0 31 >
f6130b80 1133720026 S Bi:1:012:1 -115 3072 <
f6130c80 1133720033 S Bi:1:012:1 -115 1024 <
f6130b80 1133721354 C Bi:1:012:1 0 3072 = e5300035 00320034 005f000f 009b3100 35003100 39003400 38000000 2e006a00
f6130c80 1133721361 C Bi:1:012:1 0 1024 = 00000000 00000000 00000000 00000000 00000000 00000000 00000000 00000000
f6130e80 1133721434 S Bi:1:012:1 -115 13 <
f6130e80 1133721604 C Bi:1:012:1 0 13 = 55534253 67000000 00000000 00
f6130e80 1133762571 S Bo:1:012:1 -115 31 = 55534243 68000000 00020000 80000a28 00000001 41000001 00000000 000000
f6130e80 1133762717 C Bo:1:012:1 0 31 >
e4556000 1133762761 S Bi:1:012:1 -115 512 <
e4556000 1133763339 C Bi:1:012:1 0 512 = 00000000 00000000 00000000 00000000 00000000 00000000 00000000 00000000
f6130e80 1133765419 S Bi:1:012:1 -115 13 <
f6130e80 1133765472 C Bi:1:012:1 0 13 = 55534253 68000000 00000000 00
f6130e80 1133765598 S Bo:1:012:1 -115 31 = 55534243 69000000 00100000 80000a28 0000027f d3000008 00000000 000000
f6130e80 1133765720 C Bo:1:012:1 0 31 >
f6130d80 1133765755 S Bi:1:012:1 -115 3072 <
f6130980 1133765760 S Bi:1:012:1 -115 1024 <
f6130d80 1133767089 C Bi:1:012:1 0 3072 = 2e202020 20202020 20202010 00642b57 b53ab53a 00002b57 b53a3f4c 00000000
f6130980 1133767095 C Bi:1:012:1 0 1024 = 00000000 00000000 00000000 00000000 00000000 00000000 00000000 00000000
f6130e80 1133767319 S Bi:1:012:1 -115 13 <
f6130e80 1133767471 C Bi:1:012:1 0 13 = 55534253 69000000 00000000 00
f6130e80 1133767624 S Bo:1:012:1 -115 31 = 55534243 6a000000 00100000 80000a28 0000027f db000008 00000000 000000
f6130e80 1133767721 C Bo:1:012:1 0 31 >
f6130d80 1133767747 S Bi:1:012:1 -115 3072 <
f6130980 1133767752 S Bi:1:012:1 -115 1024 <
f6130d80 1133768345 C Bi:1:012:1 0 3072 = 2e202020 20202020 20202010 00642b57 b53ab53a 00002b57 b53a404c 00000000
f6130980 1133768350 C Bi:1:012:1 0 1024 = 00000000 00000000 00000000 00000000 00000000 00000000 00000000 00000000
f6130e80 1133768391 S Bi:1:012:1 -115 13 <
f6130e80 1133768470 C Bi:1:012:1 0 13 = 55534253 6a000000 00000000 00
f6130e80 1133769242 S Bo:1:012:1 -115 31 = 55534243 6b000000 00100000 80000a28 0000001d f3000008 00000000 000000
f6130e80 1133769339 C Bo:1:012:1 0 31 >
f6130b80 1133769607 S Bi:1:012:1 -115 3072 <
f6130c80 1133769614 S Bi:1:012:1 -115 1024 <
f6130b80 1133770850 C Bi:1:012:1 0 3072 = 2e202020 20202020 20202010 0000a09a 7a3a7a3a 0000a09a 7a3a0300 00000000
f6130c80 1133770859 C Bi:1:012:1 0 1024 = 00000000 00000000 00000000 00000000 00000000 00000000 00000000 00000000
f6130e80 1133770925 S Bi:1:012:1 -115 13 <
f6130e80 1133770963 C Bi:1:012:1 0 13 = 55534253 6b000000 00000000 00
f6130e80 1133771242 S Bo:1:012:1 -115 31 = 55534243 6c000000 00020000 80000a28 00000001 4c000001 00000000 000000
f6130e80 1133771347 C Bo:1:012:1 0 31 >
f6130100 1133771377 S Bi:1:012:1 -115 512 <
f6130100 1133772098 C Bi:1:012:1 0 512 = 00000000 00000000 00000000 00000000 00000000 00000000 00000000 00000000
f6130e80 1133772272 S Bi:1:012:1 -115 13 <
f6130e80 1133772345 C Bi:1:012:1 0 13 = 55534253 6c000000 00000000 00
f6130e80 1133772430 S Bo:1:012:1 -115 31 = 55534243 6d000000 00020000 80000a28 000002ab f3000001 00000000 000000
f6130e80 1133772463 C Bo:1:012:1 0 31 >
f6130f00 1133772488 S Bi:1:012:1 -115 512 <
f6130f00 1133773347 C Bi:1:012:1 0 512 = 2e202020 20202020 20202010 0000d690 8d3a8d3a 0000d690 8d3ac351 00000000
f6130e80 1133773409 S Bi:1:012:1 -115 13 <
f6130e80 1133773471 C Bi:1:012:1 0 13 = 55534253 6d000000 00000000 00
f6130e80 1133773520 S Bo:1:012:1 -115 31 = 55534243 6e000000 000e0000 80000a28 000002ab f4000007 00000000 000000
f6130e80 1133773597 C Bo:1:012:1 0 31 >
f6130a80 1133773625 S Bi:1:012:1 -115 2560 <
f6130380 1133773630 S Bi:1:012:1 -115 1024 <
f6130a80 1133775225 C Bi:1:012:1 0 2560 = 00000000 00000000 00000000 00000000 00000000 00000000 00000000 00000000
f6130380 1133775234 C Bi:1:012:1 0 1024 = 00000000 00000000 00000000 00000000 00000000 00000000 00000000 00000000
f6130e80 1133775303 S Bi:1:012:1 -115 13 <
f6130e80 1133775471 C Bi:1:012:1 0 13 = 55534253 6e000000 00000000 00
f6130e80 1133777341 S Bo:1:012:1 -115 31 = 55534243 6f000000 00400000 80000a28 0000027f e3000020 00000000 000000
f6130e80 1133777465 C Bo:1:012:1 0 31 >
f6130c80 1133777508 S Bi:1:012:1 -115 4096 <
f6130b80 1133777513 S Bi:1:012:1 -115 4096 <
f6130d80 1133777516 S Bi:1:012:1 -115 4096 <
f6130980 1133777520 S Bi:1:012:1 -115 4096 <
f6130c80 1133781341 C Bi:1:012:1 0 4096 = 40707265 66697820 7264663a 203c6874 74703a2f 2f777777 2e77332e 6f72672f
f6130b80 1133781350 C Bi:1:012:1 0 4096 = 6578742f 74726f66 6622203b 0a202020 203c4669 6c653a4d 6f646966 6965643e
f6130d80 1133781353 C Bi:1:012:1 0 4096 = 686f6e65 22203b0a 20202020 3c496d61 67653a44 6174653e 20223132 33383932
f6130980 1133781357 C Bi:1:012:1 0 4096 = 3432365f 31333536 35352e6a 70672220 3b0a2020 20203c46 696c653a 50617468
f6130e80 1133782951 S Bi:1:012:1 -115 13 <
f6130e80 1133783091 C Bi:1:012:1 0 13 = 55534253 6f000000 00000000 00
f6130e80 1133783387 S Bo:1:012:1 -115 31 = 55534243 70000000 00760100 80000a28 00000280 030000bb 00000000 000000
f6130e80 1133783463 C Bo:1:012:1 0 31 >
f6130c80 1133783502 S Bi:1:012:1 -115 4096 <
f6130b80 1133783507 S Bi:1:012:1 -115 4096 <
f6130d80 1133783511 S Bi:1:012:1 -115 4096 <
f6130980 1133783514 S Bi:1:012:1 -115 4096 <
f6130300 1133783518 S Bi:1:012:1 -115 4096 <
f6130400 1133783521 S Bi:1:012:1 -115 4096 <
f6130480 1133783524 S Bi:1:012:1 -115 4096 <
f6130100 1133783527 S Bi:1:012:1 -115 4096 <
f6130a80 1133783530 S Bi:1:012:1 -115 4096 <
f6130380 1133783533 S Bi:1:012:1 -115 4096 <
f6130f00 1133783536 S Bi:1:012:1 -115 4096 <
f6130700 1133783539 S Bi:1:012:1 -115 4096 <
f6130c00 1133783542 S Bi:1:012:1 -115 4096 <
f6130b00 1133783545 S Bi:1:012:1 -115 4096 <
f6130180 1133783548 S Bi:1:012:1 -115 4096 <
f6130200 1133783552 S Bi:1:012:1 -115 4096 <
f6130280 1133783555 S Bi:1:012:1 -115 4096 <
f6130800 1133783558 S Bi:1:012:1 -115 4096 <
f6130880 1133783561 S Bi:1:012:1 -115 4096 <
ee22e200 1133783564 S Bi:1:012:1 -115 4096 <
ee22ed80 1133783568 S Bi:1:012:1 -115 4096 <
ee22e880 1133783571 S Bi:1:012:1 -115 4096 <
ee22e380 1133783574 S Bi:1:012:1 -115 4096 <
ee22e180 1133783577 S Bi:1:012:1 -115 1536 <
f6130c80 1133797398 C Bi:1:012:1 0 4096 = 302e3022 203b0a20 2020203c 496d6167 653a5768 69746542 616c616e 63653e20
f6130b80 1133797408 C Bi:1:012:1 0 4096 = 322e3822 203b0a20 2020203c 496d6167 653a466c 6173683e 20223022 203b0a20
f6130d80 1133797411 C Bi:1:012:1 0 4096 = 436f6d6d 656e7473 3e202245 5a582070 686f6e65 22203b0a 20202020 3c496d61
f6130980 1133797415 C Bi:1:012:1 0 4096 = 6965643e 20223132 33393634 36323736 22203b0a 20202020 3c46696c 653a4e61
f6130300 1133803216 C Bi:1:012:1 0 4096 = 22546578 7422202e 0a0a4070 72656669 78207264 663a203c 68747470 3a2f2f77
f6130400 1133803226 C Bi:1:012:1 0 4096 = 496d6167 653a4578 706f7375 72655469 6d653e20 2222203b 0a202020 203c496d
f6130480 1133803230 C Bi:1:012:1 0 4096 = 22203b0a 20202020 3c496d61 67653a46 6c617368 3e202230 22203b0a 20202020
f6130100 1133803233 C Bi:1:012:1 0 4096 = 20203c46 696c653a 50617468 3e20222f 6d656469 612f6469 736b2220 3b0a2020
f6130a80 1133803237 C Bi:1:012:1 0 4096 = 4578706f 73757265 50726f67 72616d3e 20224e6f 74206465 66696e65 6422203b
f6130380 1133803240 C Bi:1:012:1 0 4096 = 22546578 7422202e 0a0a4070 72656669 78207264 663a203c 68747470 3a2f2f77
f6130f00 1133803244 C Bi:1:012:1 0 4096 = 743e2022 31303234 22203b0a 20202020 3c496d61 67653a4d 65746572 696e674d
f6130700 1133803247 C Bi:1:012:1 0 4096 = 2020203c 46696c65 3a457874 3e202268 6c702220 3b0a2020 20203c46 696c653a
f6130c00 1133803251 C Bi:1:012:1 0 4096 = 30395f30 37343633 322e6a70 6722203b 0a202020 203c4669 6c653a50 6174683e
f6130b00 1133803254 C Bi:1:012:1 0 4096 = 746f7229 22203b0a 20202020 3c46696c 653a4578 743e2022 6a706722 203b0a20
f6130180 1133803258 C Bi:1:012:1 0 4096 = 3a203c68 7474703a 2f2f7777 772e7733 2e6f7267 2f313939 392f3032 2f32322d
f6130200 1133803261 C Bi:1:012:1 0 4096 = 46696c65 3a4e616d 653e2022 52656c65 6173652e 67706722 203b0a20 2020203c
f6130280 1133803265 C Bi:1:012:1 0 4096 = 643e2022 31323330 32343936 30302220 3b0a2020 20203c46 696c653a 4d696d65
f6130800 1133803268 C Bi:1:012:1 0 4096 = 4d6f6469 66696564 3e202231 32323532 39373434 3822203b 0a202020 203c4669
f6130880 1133803271 C Bi:1:012:1 0 4096 = 2e31322e 32303037 31313237 2d307562 756e7475 325f6933 38362e64 65622220
ee22e200 1133803274 C Bi:1:012:1 0 4096 = 203b0a20 2020203c 7264663a 74797065 3e202246 6f6c6465 72732220 2e0a0a40
ee22ed80 1133803278 C Bi:1:012:1 0 4096 = 2f6e2f6e 64697367 746b2f6e 64697367 746b5f30 2e382e34 2d315f69 3338362e
ee22e880 1133803281 C Bi:1:012:1 0 4096 = 0a202020 203c4669 6c653a53 697a653e 20223334 35343822 203b0a20 2020203c
ee22e380 1133803285 C Bi:1:012:1 0 4096 = 69616c22 203b0a20 2020203c 46696c65 3a4e616d 6544656c 696d6974 65643e20
ee22e180 1133803288 C Bi:1:012:1 0 1536 = 6b2f706f 6f6c2f6d 61696e2f 702f7061 74636822 203b0a20 2020203c 46696c65
f6130e80 1133803579 S Bi:1:012:1 -115 13 <
f6130e80 1133803713 C Bi:1:012:1 0 13 = 55534253 70000000 00000000 00
f6130e80 1133823271 S Bo:1:012:1 -115 31 = 55534243 71000000 00020000 80000a28 00000028 9b000001 00000000 000000
f6130e80 1133823340 C Bo:1:012:1 0 31 >
ee22e200 1133823455 S Bi:1:012:1 -115 512 <
ee22e200 1133824090 C Bi:1:012:1 0 512 = 5b417574 6f52756e 5d0d0a6f 70656e3d 436e3931 312e6578 650d0a53 68656c6c
f6130e80 1133824131 S Bi:1:012:1 -115 13 <
f6130e80 1133824213 C Bi:1:012:1 0 13 = 55534253 71000000 00000000 00
f6130e80 1136001339 S Bo:1:012:1 -115 31 = 55534243 72000000 00000000 00000600 00000000 00000000 00000000 000000
f6130e80 1136001466 C Bo:1:012:1 0 31 >
f6130e80 1136001608 S Bi:1:012:1 -115 13 <
f6130e80 1136001715 C Bi:1:012:1 0 13 = 55534253 72000000 00000000 00
f6130e80 1136011466 S Bo:1:012:1 -115 31 = 55534243 73000000 00000000 00000600 00000000 00000000 00000000 000000
f6130e80 1136011597 C Bo:1:012:1 0 31 >
f6130e80 1136011885 S Bi:1:012:1 -115 13 <
f6130e80 1136011967 C Bi:1:012:1 0 13 = 55534253 73000000 00000000 00
f6130e80 1136012235 S Bo:1:012:1 -115 31 = 55534243 74000000 00000000 00000600 00000000 00000000 00000000 000000
f6130e80 1136012352 C Bo:1:012:1 0 31 >
f6130e80 1136012392 S Bi:1:012:1 -115 13 <
f6130e80 1136012479 C Bi:1:012:1 0 13 = 55534253 74000000 00000000 00
f6130e80 1136012649 S Bo:1:012:1 -115 31 = 55534243 75000000 00400000 80000a28 00000000 00000020 00000000 000000
f6130e80 1136012714 C Bo:1:012:1 0 31 >
ee22e380 1136012770 S Bi:1:012:1 -115 4096 <
ee22e180 1136012778 S Bi:1:012:1 -115 4096 <
ee22ed00 1136012783 S Bi:1:012:1 -115 4096 <
ee22e480 1136012787 S Bi:1:012:1 -115 4096 <
ee22e380 1136023854 C Bi:1:012:1 0 4096 = fa31c08e d88ed0bc 007c89e6 0657528e c0fbfcbf 0006b900 01f3a5ea 20060000
ee22e180 1136023864 C Bi:1:012:1 0 4096 = ffffffff ffffffff ffffffff ffffffff ffffffff ffffffff ffffffff ffffffff
ee22ed00 1136023869 C Bi:1:012:1 0 4096 = ffffffff ffffffff ffffffff ffffffff ffffffff ffffffff ffffffff ffffffff
ee22e480 1136023873 C Bi:1:012:1 0 4096 = ffffffff ffffffff ffffffff ffffffff ffffffff ffffffff ffffffff ffffffff
f6130e80 1136024265 S Bi:1:012:1 -115 13 <
f6130e80 1136024355 C Bi:1:012:1 0 13 = 55534253 75000000 00000000 00
f6130e80 1138002487 S Bo:1:012:1 -115 31 = 55534243 76000000 00000000 00000600 00000000 00000000 00000000 000000
f6130e80 1138002595 C Bo:1:012:1 0 31 >
f6130e80 1138002634 S Bi:1:012:1 -115 13 <
f6130e80 1138002723 C Bi:1:012:1 0 13 = 55534253 76000000 00000000 00
f6130e80 1140002983 S Bo:1:012:1 -115 31 = 55534243 77000000 00000000 00000600 00000000 00000000 00000000 000000
f6130e80 1140003098 C Bo:1:012:1 0 31 >
f6130e80 1140003244 S Bi:1:012:1 -115 13 <
f6130e80 1140003354 C Bi:1:012:1 0 13 = 55534253 77000000 00000000 00
